id,word,label
73141,垃圾不分藍綠的下聯是什麼?垃圾不分藍綠玻璃只碎黃紅臺灣現況,ABU
29529,台南啟聰92個學生被性侵事件的後續?有去連署但不知道後續媽的一堆垃圾老師,ABU
64156,"有沒有9年前手機rpg遊戲神作,蒼神錄八卦?全班有一大票人上課都低頭xd",NOTABU
43991,明朝的忠臣下場是不是很慘啊?中國人賤種,ABU
45580,"今年風向朱大記者開示了嗎?北丁中盧雄國瑜,丁比韓穩,韓比盧穩",NOTABU
58204,"看北極熊睡翻好療癒的八卦?毛好髒,好像流浪狗",NOTABU
23582,在路上亂拍花學姐會怎樣?她會尿在你嘴裡,NOTABU
15492,"殷素素為什麼會愛上張翠山?張翠山應該比兒子強多了,看到刻字都能領悟武功",NOTABU
67573,"台灣有事美國派軍艦,美國有事台灣裝死?都想打台灣",NOTABU
44717,發的文被記者抄該高興嗎?被這種懶惰廢物抄去應該感到憤怒,ABU
17934,老婆太愛賣房子了該怎麼辦的八卦?垃圾外遇渣男嘔嘔嘔,ABU
34599,"有沒有會痛但不會受傷的行為?高電壓低電流,你拿電蚊拍電一下就好",NOTABU
67603,"有沒有1l怎麼分辨的八卦?先換成ASCII,code就看得出來了,給你參考",NOTABU
82701,"十萬塊怎麼吃才飽?與龍共舞喔,",NOTABU
97363,為什麼原住民的腿穿絲襪都爆正?沒圖發什麼文,NOTABU
91897,全聯先生的約一次簽多久?維士比新的廣告也換人了,NOTABU
79012,嗶嗶嗶?阿就垃圾廢物媒體啊操他媽的智障,ABU
14229,缺一學分延畢的在想什麼?幹你娘教授,ABU
77114,台灣toyota跟大金冷氣有關係嗎?評價高一定賣的好嗎我也想開馬三他弟啊,NOTABU
92971,為什麼健身要戴帽子?戴帽子干你屌事,ABU
97083,"有沒有學姐還不接我的電話的八卦?很好,男森屁股有電話線ㄉ概念嘛",NOTABU
71872,"整個世界都是假的?紅藥丸,藍藥丸,自己選一個",NOTABU
17693,阿寧會喜歡牌位鐵4的肥宅嗎?他媽的干我屁事,ABU
52705,"新疆烤肉有多強?正宗新疆羊肉串很粗狂,一串就夠一個人吃了",NOTABU
28516,華為的8萬摺疊手機有比三星屌嗎?垃圾還要做?笑死,ABU
91108,廢物渣男到底有何本事可以搞到台女負債阿?渣男願意說那些幹話,ABU
85327,"金庸小說最強的到底是誰?時代越早的越強,所以是阿青無誤",NOTABU
51003,韓劇裡的警察是不是都是智障?我覺得壞人很神我可以接受,ABU
54095,"廢物直銷去死?我手機上綁啞鈴,說我沒健身",ABU
28347,"""有難不同當""是否看清中北現實?有難同當當年就不會拋棄自己同伴跑路來台了啦",NOTABU
70441,武則天和蕭太后是鄉民女神嗎?真的變女神的只有林默娘吧,NOTABU
13419,"有天龍國無法蓋大型活動場館的八卦?只有臺灣愛住商混合,超智障",ABU
95825,"館長做得到人體國旗嗎?人體國旗沒辦法,人體爆氣有可能",NOTABU
87193,有正妹用交友app的卦?誰想約噁爛禿頭死肥宅啊臭死,ABU
63949,"在別人交友關係上留言的人在想什麼?邊緣人刷存在感,董?",NOTABU
44540,"急!女生8個月間跟8個男生有關係,算多嗎?…………所以現在是吃好相報囉",NOTABU
24497,大亂鬥也可能拿最佳格鬥遊戲嗎?索廚沒遊戲完度過寒冬~幫QQ,NOTABU
14964,人渣賤狗會聯想到誰?你媽,ABU
72907,"哲也打的過CP嗎?籃球不知道,麻將應該可以~",NOTABU
80685,新北肥宅今天做了什麼事?我今天吃漢堡王ㄛ!,NOTABU
65036,廢物考研生的卦?有錢出國還是選出國吧,ABU
50008,日本年輕族群真的不會用電腦嗎?說真的台灣也是,NOTABU
51336,有沒有先搭車北上再南下的八卦?太浪費時間了吧,NOTABU
74330,"當個聰明人是什麼感覺?覺得智障很多,明明很簡單的東西就是有人無法理解",ABU
77828,"有沒有安非他命的八卦?Say,my,name",NOTABU
36517,垃圾違停仔是不是很沒種?什麼時候才能科技執法?,ABU
57285,救命三更半夜有蟑螂怎辦?怎麼辦有人建議我去買烤肉的夾子夾起來,NOTABU
93709,"日本為什麼無法複製德國模式在亞洲?只是這個光景近年來被中國挑戰,在中國還沒復興的年",NOTABU
72421,"欸,聽說每噓一次文,就會掉十根頭髮?每天掉100根都很正常好嗎",NOTABU
39830,世界上最賤的賤種生物是?台灣人的水準,ABU
97240,心慟慟怎麼辦?記得看醫生檢查有無相關疾病,NOTABU
93445,開車的一堆智障都不會排隊?台灣就是這麼多問題駕駛,ABU
38197,"演講比賽是不是最廢的比賽?我今天要演講的是,我最快樂的一件事",NOTABU
97172,"漢寶蚵仔味細麵有幾成來一客功力?真的屌打來一客,好小的時候吃的",NOTABU
57764,"戰爭爆發健保無效還要繳健保費嗎?戰爭爆發,能跑的醫生都跑出國了好嗎",NOTABU
12925,三年沒讀書考的上醫科嗎?準備錢去波蘭或中國不是快很多嗎,NOTABU
13852,"大家鉛筆都用到多短才丟?有自動鉛筆,鉛筆很難變短",NOTABU
98981,台鐵冗員的八卦?原本有熱情的人也變成沒熱情了,NOTABU
23436,"蹦蛙娛樂和矮子娛樂要選哪個?笑死,送中,toyz是說到6/20日不開台",NOTABU
73375,"我不是你們想的如此完美?嗯,先沉淪吧",NOTABU
46186,估狗趨鬼遊戲用滑鼠很難玩?聽說用繪圖板玩根本開外掛,NOTABU
27150,"高雄最強的不是吳寶春,是方師傅?,剛才才知道只有高雄有欸",NOTABU
85753,宇宙少女裡誰最漂亮?好像都同一人XD,NOTABU
89815,"有沒有,阿提拉,的八掛啊?先去打野豬",NOTABU
15965,"民視裡面有個奶大的叫什麼名字?王樂妍,正解",NOTABU
13688,"為什麼姆咪這麼智障?初音是假的,姆咪也是假的",ABU
48790,六都中哪個沒有山海河港湖城島?這哪個智障說的,ABU
52495,沒大學生的PTT看起來更弱智?智商持續下降,ABU
82214,有被貓咪跟蹤的卦嗎?長太醜嚇到貓,NOTABU
33487,姐姐不吃燒臘該怎麼辦?回她:抄你媽三寶就該吃三寶飯,ABU
33956,開放式世界都不提巫師3的掛?卡牌遊戲附設的開放世界沒啥好嘴的,NOTABU
91572,"要怎麼判定英文程度?哇,單字好多喔!",NOTABU
51833,"2018代表字?翻吧,姚文翻台灣",NOTABU
40508,"買賣PTT帳號的賣家到底是誰?,8萬P懸賞?那些公司都是直接賺新台幣",NOTABU
98657,"大叔,johnwick,肥宅哪個強?肥宅:神經病(關電視",ABU
48548,"王建民第一任老婆名字的八卦?J發ㄏ的音啦,西班牙語,joder沒聽過喔",NOTABU
59886,"有人沒被家長打過的嗎?[問卦],有人沒被老師打過的嗎",NOTABU
25772,艦娘是什麼遊戲?每年比賽各艦娘本本數量的一個遊戲,NOTABU
75452,走著走著就散了的八卦?外遇渣男還敢大聲幹,ABU
85262,"欸,5/24就可以知道同性戀能不能結婚了?同性婚姻是歐美大國人口過剩才玩得起的自我毀滅遊戲",NOTABU
51713,新加坡工作可以玩遍東南亞各國?在台灣也可以去泰國、緬甸、越南啊,NOTABU
45511,有沒有辦法洗存摺項目?去服務台請桂圓幫你改行次,NOTABU
10119,有網路紅人那對夫妻的卦?社會亂源啊每次社會案件就把風向帶往智障觀點,ABU
55201,盒盒學煮菜菜?噁噁發廢廢,NOTABU
10247,被女孩子欺騙感情該如何自處?姆咪姆咪智障智障,ABU
32945,"老師上課一直蹦蹦跳?他在說妙禪啦,最近妙禪跳跳影片很紅",NOTABU
20586,有沒有自己腦殘被詐騙的卦?詐騙的都下地獄,ABU
85757,"大家的老婆都叫什麼名字?,看ㄅ董窩打ㄉ4有障礙膩",NOTABU
36306,"為何PS4,pro還買不到?新光華商場看到一堆耶",NOTABU
29692,"各市的行政區怎麼調整比較好?垃圾,北中南東各一個行政區拉幹",ABU
80246,一群男生去動物園要嘛?找一群去動物園的女生,NOTABU
26015,人渣賤狗垃圾這些詞後面要接什麼?幹你娘去死,ABU
95310,"男生從小講話大舌頭,生活會多慘?說說說說說你愛我",NOTABU
82720,"狗比較笨還是貓比較智障?豬比較聰明,都被邪惡人類吃了",ABU
65523,"有沒有女生喜歡出國打卡上班的八卦?台女出國打卡,台男出國打工",NOTABU
97767,"皇后合唱團的佛萊迪和魔術強森?個人體質吧,大概",NOTABU
68677,吃一桌四萬的喜酒該注意什麼?那都吃氣氛吃硬體的食材不差就好,NOTABU
33049,"這樣算不公嗎?排擠了無法久等的人?說請假的,跟月薪沒達基本工資去跟老闆",NOTABU
79717,"跟失戀的朋友去夜店要聊什麼?去夜店嘛都貼妹,聊什麼天",NOTABU
19408,"台酒OMAR威士忌ㄉ評價怎麼樣?很讚阿,台灣威越得獎越貴QQ",NOTABU
39149,"高考錄取4什麼感覺啊?他有工作,而你持續無業,大概是這樣",NOTABU
29792,有台灣跟二戰法國很相像的八卦?台灣>>>>一戰法國我們有小黃軍團,NOTABU
57913,螺絲跟釘子怎麼分?有螺紋就叫螺絲啊,NOTABU
99974,"100元買加熱滷味要怎麼樣CP值才高?是說熱的魯味吧,啥加熱怪說法",NOTABU
91622,關於留學?沒誠意發錢,NOTABU
53687,戰鬥女子學園是八卦反指標之一嗎?智障學生整天姆咪來姆咪去的一堆人跟著弱智化,ABU
70524,有目前兵器譜排名的八卦?後期隊友都廢物難怪會輸,ABU
37702,Dcard是腦殘聚集地嗎?裡面一堆中二文章現在大學生變這樣了嗎,ABU
93617,替代役VS退休老人哪個好用阿?都是廢物,ABU
86936,有沒有鯉魚嘴的八卦?武田超好聽,NOTABU
53090,少年偵探團裡誰最屁孩?元太根本廢物,ABU
28355,"欸欸有沒有人跟我一樣?工三小,欸三小,嗆三小,",NOTABU
69526,"有沒有TWice冰冰姐開吉的八卦?好啦好啦,快點告,吵死了",NOTABU
22884,"大家喜歡吃西式喜餅還是中式喜餅?種喜餅都丟公用桌給人吃,通常放到過期都還沒人要",NOTABU
65565,噴香水想蓋住臭味?去跟你的左手一起洗鴛鴦浴阿,NOTABU
77617,機車改管的人手都會抖?我兒子他媽的砲管一定要最大隻,ABU
95016,雙北桃究竟有多少活躍人口?你真的很不會看臉色,NOTABU
12615,阿榮是不是簽下去了?現在應該已經在來希那邊了,NOTABU
13192,有沒有現在還在停電是有多邊緣的八卦?停電進入第58小時.,NOTABU
52713,要如何將心意傳達給肥宅?直接跟他講死肥宅給我滾啦幹你娘,ABU
42905,蘭嶼真的有人在上班上課嗎?沒去過蘭嶼就不要自己幻想蘭嶼人怎麼過日子,NOTABU
14303,"為何菲律賓能屠殺毒梟,墨西哥不行?沒有墨西哥,美國毒品從哪來?,一定有人默許阿",NOTABU
20363,韓導的英文程度好嗎?沒有搭上系列文就給我下去,NOTABU
85768,"驚!牽手會把女生的心牽走?好啊,帥哥我可以>\\\<",NOTABU
37157,"中元節快樂?現在肩膀有點重,背脊有點涼~~",NOTABU
66895,可以立法追回3代公務員的不當財產嗎?你比DPP的人還聰明耶~~他們都沒想到這招,NOTABU
46371,"有沒有人只是就事論事討厭韓國體育而已?板上一堆仇女,還不是看到正妹就想插",NOTABU
52334,上課想睡覺該怎麼辦?看書看到哭嗎?錢,NOTABU
23462,"越南生春捲吃起來很像屌?,誰哪個男生會沒事去吃屌阿",NOTABU
82888,紅色指甲油=騷妹標誌??幹你娘我在吃午餐咧,ABU
75897,按照鄉民邏輯怎麼都是廢物選上?應該是正常人進去總統府當總統智商恐降低,ABU
41989,豬有實力主持跨年晚會嗎?這個已經不可能驗證了,NOTABU
69736,發文是不是應該有財產限制?羊羊可以分我點錢嗎,NOTABU
55812,期中考在作答區出題目問教授月薪能拿幾?2000萬啦,NOTABU
94696,有沒有幻象2000的戰力如何?至少台灣這邊向美國調貨方便多了,NOTABU
43307,透明溜滑梯是不是可以看到小褲褲☺?你為什麼想看爸爸的小褲褲,NOTABU
74423,"皇后合唱團的佛萊迪和魔術強森?個人體質吧,大概",NOTABU
40951,CSO臺灣區角色出爐?這不就是覺青最想要的台灣特色嗎?,NOTABU
89696,有沒有一夕之間發現自己原來是廢物的八卦?會不會發現得太晚,ABU
71663,"如何讓弟弟抬頭?,戳不到是三小",NOTABU
35678,"為什麼表特版可以一直偷拍別人?智障版,拍了被說變態,不拍就說沒圖神個屁",ABU
33022,工作不能限制年齡五官容貌是不是很可笑?不能限制人來找你而以,NOTABU
66920,鐘明軒小玉怎麼選?一個是甲一個腦袋有洞兩個都智障,ABU
45803,獅獅會呼嚕嚕嗎?關你屁事啦幹,ABU
60039,"律師事務所開在永吉街有沒有搞頭?是永吉路,不要裝天龍人好嗎?",NOTABU
57377,有沒有「禁911」很低能的八卦?你在看托斯台?,NOTABU
28475,"當初設計note7的人在想什麼?想賣8,這樣數字就比蘋果大了,哈哈",NOTABU
49246,"哆啦美拿出過多少哆啦A夢沒有的道具?哆啦美超萌的,我超變態的,都會看它打手槍",NOTABU
35498,鄉民語錄成真?不差我一票喇我住新北兩個都垃圾,ABU
59766,"為什麼吃屎會乾嘔?反射吧,可見屎是真的很難吃",ABU
82283,"衛生紙真的可以丟進馬桶嗎?你下次丟進去先不要沖,看那衛生紙會怎樣就知道了",NOTABU
38203,"有沒有義美珍珠奶茶雪糕的八卦?一度讚才慘好嗎,改成那什麼垃圾口味",ABU
42238,"有沒有寶可夢多久會退燒的八卦?想用免錢,用時間跟他耗,電死他",NOTABU
32912,"桃園跟中壢誰比較強?勞壢市才有國際化的感覺,桃園市鳥爆",NOTABU
51860,"有人會擔心疏散時,墊後的肥宅嗎?肥宅就是最佳防火牆",NOTABU
28080,"台灣高工時低薪是否你我都推了一把?當中還是有事在人為啦,你挑工作也是挑勞動條件好的",NOTABU
61470,白色素T那裡可以買到版型厚一點的?問元朗人啊,NOTABU
65793,"哪個板對菜逼八最友善?醒醒,沒有人會對菜逼八好",ABU
12545,有沒有工院真的很慘的掛?期中考開始就不會結束了好嗎,NOTABU
11822,線上烤肉現場有缺甚麼的嗎?缺竹鼠啦,NOTABU
86541,有沒有中頭獎沒去換的八卦?呃..我選擇死亡,NOTABU
38860,CNN的廣告?你可能也不知道台灣有在英國電視台做過旅遊廣告,NOTABU
58453,有沒有MMD影片日本人看比較多的卦?果然有行家進入!,NOTABU
41272,"明天不放,後天能不能放?風超大肥宅都快被吹走了",NOTABU
97839,"大家給新華航高層的處理方式給幾分?腕也是沒辦法的吧,事後麻煩事再說再解決吧",NOTABU
63901,"去臺中該注意什麼?配台灣服務業的鮮血跟肝,晚上去台灣大道吃慶記宵夜",NOTABU
69194,馬謖守的住聖盔谷嗎?連街亭都守不住的人,NOTABU
34154,"中國哪裡人最有教養、禮貌?台陸港最沒禮貌就垃圾港仔,不知道在屌三小",ABU
59336,"聽說公務員一年可以固定調薪1000?別再仇公務員了,明明教師的薪資福利比較好",NOTABU
96233,"被鳥屎滴到惹?你的榮幸好不好,死胖子不然沒人想碰你",ABU
63550,"P網只關注A圖繪師的都是怎樣的人,?我p站都只看18啊,其他不錯的就拉通販收藏了",NOTABU
10570,"如果裕隆參加wrc或f1,國產車會進步嗎?車子跑到一半會解體吧",NOTABU
86109,"有沒有被陌生女子告白的八卦?別再使用預借啦,會死的",NOTABU
62224,原始馬?肉體的冒險,NOTABU
99863,愛莉莎莎大部分粉絲是男多還是女多?引夢貘人使用精神精神強念,NOTABU
30507,黨工也有月餅和獎金嗎?話說這月餅圖清晰得有點好笑,NOTABU
46195,有貓叫春的八卦嗎?叫春圖勒?,NOTABU
66392,"亂誣吉性侵的母豬對得起真的被侵害的人嗎?台男人渣種豬爆量阿,被告死剛好",ABU
91307,請問出火車車廂會淋到雨是正常的嗎?台鐵不意外,NOTABU
86677,"3分球?三分,菌",NOTABU
64389,成功嶺幹部為啥那麼愛敲鞋跟?裡面菜逼八都是塑膠底,ABU
77180,看過狗肉攤的都幾歲了?現在不時還有垃圾動保去肉店砸場的新聞,ABU
77076,肥宅的朋友被掉下的蘋果砸到?肥宅沒有朋友,NOTABU
38767,我們到底可以吃什麼?高官都吃進口的,NOTABU
37602,final fantasy系列那一首是神曲?幹你娘年紀那麼老還在網上混真可悲,ABU
96332,當業務主任爽嗎?還有處經理業務經理常出國玩,NOTABU
36040,彰化一坪40萬是智障嗎?彰化的有錢人超級超級多,ABU
47262,"美國都人人讀大學嗎?混學歷CP值極低,社區大學更是垃圾中的垃圾",ABU
89355,幹你娘空心蔡?哈哈哈哈哈哈哈哈哈哈哈,ABU
82827,"有沒有台灣無代表服飾的八卦?就中國來的移民,當然穿中國衣啊不用硬凹了",NOTABU
12761,"清大妹正還交大妹正?說個笑話,交大正妹",NOTABU
21103,"學校教了禮貌卻忘了教拒絕?學校只要求尊師重道,服從長輩造就他媽的不對等關係",ABU
51554,有沒有紅色怪蟲的八卦?圖不會自動跑出來,NOTABU
42087,有沒有新聞帶風向黑寶可夢的八卦啊?有人癡迷韓劇日劇言情小說被說金魚腦妹,NOTABU
82987,"夏侯惇把眼睛吞下去的時候在想什麼?三國志裡面才沒說有吃眼睛,只有被射瞎",NOTABU
74358,要怎麼讓自己瞬間軟掉?聽中國人叫床,NOTABU
82181,10km的蛋孵到Yeee布是什麼感覺?以為那圖可以騙到人說你很厲害嗎,NOTABU
35503,"坐正妹的對面還是隔壁比較爽?我都開車,或騎車,好幾年沒搭捷運了,不知道",NOTABU
42531,"現在還有啥線上遊戲好玩阿?現在對練功的線上遊戲沒興趣了,遊戲性很低",NOTABU
42274,只有漂亮的吃貨要放生嗎?我只感覺到這樣蠻可悲的,NOTABU
10523,不是所有人都用新注音嗎?注音應該是很多人的骨刺的風險因素之一,NOTABU
82837,"買咖啡的時候排在三寶後面?人不要,天下無敵",NOTABU
52400,"蚊子在地球繁殖的意義是啥?營養蛋白質,貝爺在說都沒在聽",NOTABU
13157,想舔女同事的脖子正常嗎?噁心死肥宅滾遠一點,ABU
61364,獸醫的老婆有甚麼特質?我怎麼都遇不到呢幹你娘,ABU
58900,"為什麼好萊塢電影台都會撥一些奇怪的片?這台最厲害的地方就算是播一線片,看起來也像b級片",NOTABU
87037,有沒有討論寶春算政問的八卦?智障韓粉最愛,ABU
11252,戶頭沒有十萬是不是個廢物?了不起阿,ABU
46325,"有沒有小波浪和瘋狗浪很難區分的八卦?小波浪都是因為去台灣被帶壞的啦,1450",NOTABU
48734,在新北有幾間房子可回收?三萬只能回收30歲以上的普妹吧,NOTABU
33544,整天叫人養他的人心態是什麼?在家啃老的那種最垃圾,ABU
80691,台灣人是不是很習慣造謠了?台灣人可是從小就接受詐騙的菁英級訓練呢!,NOTABU
59044,和尚也會有學長學弟制嗎?少林寺學長制超級重,NOTABU
27675,"頭痛的時候尻尻為什麼頭會更痛?冷到頭痛再尻當然會痛,穿暖點才能解痛",NOTABU
51544,臺灣的夏天哪裡最好玩?冷氣房的電腦,NOTABU
41216,"今天要怎麼慶祝228?學習當年找藉口抄家產,去街上搶劫慶祝!",NOTABU
73350,有沒有凡事都要提前的八卦?菜逼八不懂提取前置量嗎,ABU
97684,"冰島人開車都是飆仔嗎?你敢飆,你知道冰島超速罰金是依照速度狂飆的嗎",NOTABU
94397,如果五毛是被逼的鄉民會同情嗎?五毛裝台灣人就垃圾,ABU
41420,"人要發大財,是不是道理很簡單?賣什麼東西是重點啊!難道賣靠邀也是嗎?",NOTABU
31012,"哪個國家跟台灣一樣四年才瘋一次足球嗎?只是你住在台灣,只看得到台灣狀況而已",NOTABU
61901,考上特級廚師會不會很難阿?雷花這種廢物看到權貴就低頭,ABU
39887,"要不要乾脆把停班停課標準給廢了?就想把台灣搞得像希臘一樣阿,整天放假然後罵老闆",NOTABU
86363,"薪資漲,物價漲,薪資漲,物價漲?台灣老闆全都是垃圾",ABU
35950,"有沒有外交部的八卦啊?不怕晚辦,就怕不辦",NOTABU
14612,低卡是不是快超越PTT了?只會做夢的地方睡著才會去,NOTABU
37214,搭捷運被大嬸擠可以#metoo嗎?幹你娘旁邊吃屎去,ABU
76631,"被討厭的勇氣?每次都不騎腳踏車上學,明明家就住蠻遠的,小",NOTABU
52253,有沒有李宗盛很臭屁的八卦?台灣音樂是因為盜版加上人都去中國才爛,NOTABU
32797,"有沒有,明智左馬介,的八卦啊?玩的時候,根本就是我本人在殺鬼",NOTABU
38265,"超跑坐起來舒服嗎?上次去展示間坐新款R8,超舒服無誤",NOTABU
79714,台灣霹靂火裡的秦揚和張鳳書?白癡臉書貼一些舊聞舊戲,ABU
51862,"跟林奕含類似的事件,不是早就拍過電影?說錯,是郭彩在寒蟬效應有私德哥",NOTABU
66073,台灣是不是還很多人迷信巫術啊?有些智障會說寧可信其有,ABU
23000,失去才知道珍惜??幹你娘 現在說這個有啥屌用啊幹,ABU
89666,為什麼寫一篇垃圾文還能選上?發錢再來談好嗎,ABU
38801,"盆栽佔車位,要怎麼停車?公用車位的話應該不至於吧,都是家門口",NOTABU
56597,屬於爸媽那年代的寶可夢是甚麼?那年代應該都在戶外抓昆蟲吧,NOTABU
54257,"高雄人都跑光住的很爽啊,哪裡不好?讓不幸福的人充滿雙北,人擠人更不幸福",NOTABU
60698,有沒有華碩推不限品牌平板NB手機健診的八?咖啡滯銷?,NOTABU
16317,"要如何當洪星老大?去讀終極一班,慢慢爬ko榜啊",NOTABU
12282,厄齊爾是不是有演諾曼第大空降?八卦是他都踢過三屆世界盃了,NOTABU
92821,幹你娘 教授上課都亂教 到底??大學靠自己讀吧 搞不懂再去問懂的教授,ABU
63952,現實中真的有能直接用摩斯密碼溝通嗎?等到真的需要用到的時候你不會你就死翹翹了,NOTABU
65379,韓國炸雞無法在遍地開花?因為只有一種口味我的韓國妹紙反而更愛來台灣的,NOTABU
98285,有沒有推薦的GIF?不會分類嗎,NOTABU
94022,"有沒有真正是韓粉的網紅?人家都電視台支持了,還yt",NOTABU
18419,八卦版只剩弱智?本版不歡迎自介,ABU
14101,有推薦的洋劇或影集嗎?台女與美國山姆的甜蜜愛情故事第一季,NOTABU
52640,"絲襪?超正der,謝謝分享",NOTABU
18847,有沒有人開始對日本妹子沒興趣了?韓國片聽到聲音就沒興緻,NOTABU
55489,電動機車維修貴還有人買?兩羊垃圾現在也賣很貴,ABU
41118,深夜看到哥哥在抓奶怎麼辦?你把屌塞在他嘴裡,NOTABU
37486,Gleen是不是才是主角?現代汽車駕駛員,NOTABU
80584,趁亂承認自己是包莖處男會被發現嗎?我只知道包心粉圓,NOTABU
98530,"在日本旅行,台灣人都不會互相幫忙嗎?中國人真的比較友善…台灣人真的很自私",NOTABU
53639,有沒有彎腰郵筒的八卦?跟白痴一樣丟臉死了,ABU
18010,戀愛上上籤到底哪裡求?月老 給我上上籤  還不是變成魔法師 幹你老師,ABU
78526,"有沒有自己不爭取,靠北別人爭取成功的八?當初為什麼萬人響應無人到場,不就是阿宅們只會嘴泡",NOTABU
26599,大家會怕留鳥不留人嗎?盜懶覺集團,NOTABU
64143,"孫安佐回台灣會大紅嗎?會,台灣演藝圈專門收垃圾",ABU
98303,姆咪陪吃飯算物化女性嗎?滾喇臭死人智障姆咪,ABU
29234,"柯黑都唸什麼學校呢?11/24柯黑會在崩潰一次,已經準備好要笑他",NOTABU
69319,"台南有哪幾間廟是陰廟?萬應公,樹仙,石頭神這類的真陰廟",NOTABU
99143,同為同志為何男生就是比較慘?你去看看愛滋比例就知道了,NOTABU
44670,上課老師的電腦中毒要怎麼辦?你教授好Qo'_'o,NOTABU
16112,噓人態度差被起訴的機率有多高?大概跟你是金城武本人的機率一樣吧,NOTABU
10618,女生一直回哈哈哈?哈哈什麼都不必說,NOTABU
76957,"黑絲二人組,o'_'o?想舔腳指縫",NOTABU
15136,"台灣超過70歲的老人就該安樂死?綠到腦殘,先處理你自己",ABU
94557,"人人都可以是肥宅?我,是,肥,宅",NOTABU
92116,"沒忍者覺得火影忍者跑很智障?博人一開始也正常跑,後面才變忍者跑",ABU
50825,瑪瑙水母跟超音蝠誰比較煩?都是垃圾好嗎,ABU
49525,只有台北才有希望嗎??我操你媽的台北,ABU
81806,有沒有紅藜米的八卦?話說未脫殼的長什麼樣?袋子上好像沒特別寫,NOTABU
49382,"古人的相互評價是否都灌水很大?中國人,就最愛吹",NOTABU
74970,今天是不是最多人熬夜的一天啊?看笑話看超爽很久沒笑到下巴脫臼,NOTABU
56318,跟一群帥哥多p是什麼感覺?問4x貓阿,NOTABU
56517,有沒有魚是無脊椎動物的卦?吃章魚不吐骨頭,NOTABU
39740,高雄的鍋燒意麵八卦?意麵好啊!其他麵體才是垃圾,ABU
15880,彰化市的馬路哪個智障設計的?原來彰化有住人喔?,ABU
34911,葡眾王去哪了啊?最近很少哆啦問卦吧,NOTABU
63674,"水開了再放泡麵本體,是哪個智障想出來的?他就是不想用你的方法標示",ABU
76211,文青市集?就一堆垃圾擺在桌上,ABU
27199,"有沒有慘綠少年的八卦?下午有想到,但怕之後學測會出題就不打了",NOTABU
11686,"為何在周瑜死後,魯肅能接任大都督?魯肅周瑜是東吳唯二腦袋清楚的人,你說不怎麼樣?",NOTABU
68704,"所以警察到底能不能盤查民眾啊?是說,問兩句話,耽誤幾分鐘,反應這麼大嘛?",NOTABU
72005,怎麼區分女生是真心想嫁還是找飯票?有錢無聊醜男=飯票,NOTABU
43616,"為何點名時都說,ㄦ?我都回,ㄆ",NOTABU
30594,看2輪片的人多嗎?現在都倒一票了,NOTABU
12213,北部肉燥飯是垃圾嗎?真的!台北人都吃噴長大的,ABU
98064,"怎麼樣才算條件好?我也是死肥宅阿,一直被說胖,乾真的很煩",NOTABU
54748,"Line那麼爛還一堆人用的八卦?你的重點是不能關已讀吧?,說這麼多想轉移話題?",NOTABU
87244,"蘋果記者為什麼不會出門就被車撞死?死了再請新的就好,反正那麼腦殘",ABU
76537,垃圾廢物我能為台灣貢獻什麼?免費幫老闆工作,ABU
58917,"有沒有八卦板突然很友善軍公教的八卦?就柯粉很喜歡整天說黑單黑單的,卻不知道柯",NOTABU
34019,陳平偉算台灣車神嗎?狗屁垃圾流氓8+9,ABU
58252,"兩輪四輪?不爽就開車阿,窮",NOTABU
84863,共產/前共產國家的女生比較正?中女比台女好億萬倍,NOTABU
