id,word,label
92675,Dcard最常出現的一句話?廢物學店不讀書整天翹課幻想寫小說,ABU
58033,肥宅們會幫忙正妹重灌電腦嗎??我真的這樣回。其實我想回：幹你娘當我工具人膩,ABU
50644,"初戀就結婚且婚姻穩定算幸福嗎?很好啊,一次就遇見對的人哪裡不幸福了?",NOTABU
91181,計程車司機為何這麼多垃圾?所以是太多台灣人是垃圾,ABU
60227,黑人走在路上是不是一定要戴耳機?一定要媽的發科啊,ABU
49582,"熊熊打籃球?熊熊還能幫皮卡丘拿奧斯卡,你說厲不厲害",NOTABU
96305,"有沒有胖老爹的八卦?台灣,X中國台北,〇",NOTABU
72849,每條大街小巷每個人的嘴裡都有什麼東西?就是摃死摃死,NOTABU
78383,"人生走到最後一哩路的感覺是什麼?ㄟ(|v|)o,先承認,老娘或許還有辦法",NOTABU
94995,"昨天我沒去買麥當勞搶便宜,怎樣!棒吧?好了啦~你的心情我懂^.<",NOTABU
66933,"變態鎖匠,女廁偷便便,開模量產益智鎖?圖靈測驗會過嗎?SIRI也說他是人",NOTABU
91515,有沒有國家機器的八卦?國家機器只是一個形容詞,NOTABU
13639,"伊莉雅竟然穿這麼H的服裝?臭,我現在聖人模式",NOTABU
84814,有人打農曆跨年砲嗎?操妳這渣男滾啦幹嘔嘔嘔,ABU
97675,"吃飯遇到替身使者怎麼辦?jojo,我不當人了啊",NOTABU
88938,濁水溪以南最棒的夜市是哪一個?大大武花大武花,NOTABU
43274,"貧窮靠努力讀書翻身是屁話嗎?現在都買房了,我覺得台灣很好翻身了",NOTABU
17138,我等的船還不來?傷心太平洋底深深傷心,NOTABU
53892,"帶女同事吃無菜單料理吃完直接翻臉?他以為是日本料理,結果只是台灣小吃,",NOTABU
58233,"沒按過同意,被微軟強制中獎win10?早就沒再更新了,你時空旅人?",NOTABU
91006,弟弟想上112怎麼辦?大葉啦112那什麼垃圾學店,ABU
80338,舊衣回收之後會跑去哪裡?拿去慈濟or育幼院之類也不要丟回收桶,NOTABU
70596,"以後電動腳踏車是主流嗎?好,價格有點高",NOTABU
28886,大麻還好吧?台灣就是一堆腦殘粉,ABU
73619,"女生不坐我旁邊?有時搭捷運,明明空位還很多,妹子卻都坐我正對面",NOTABU
89713,記者說石虎粿原料是石虎?台灣記者日常,NOTABU
27244,"新竹要喊什麼口號比較好?,還真的只缺女生",NOTABU
47270,"一休哥現在在想什麼啊?機掰,早知道賣衣服了,賣什麼瑜珈墊",NOTABU
41066,FB簡稱Messenger怎麼沒有人抗議?FB現在一堆糞功能而且還不給移除垃圾媒體,ABU
23151,有人還沒睡嗎嘻嘻?笑三小幹你娘,ABU
90181,"有沒有中東天選之戰-贖罪日戰爭的八卦?中東諸國各自心懷詭計,當然被打爆啦",NOTABU
50036,"有沒有許萌希的八卦?覺得本來叫許加穎比較好聽,萌希這種日系",NOTABU
67361,"黃國昌,20181212?血統純正,台灣價值高",NOTABU
30602,LBJ為什麼總是無法洗白?廢物LBJ沒品靠全明星隊友史上最噁心球員,ABU
14284,有沒有黃仲崑的八卦?誰知道房子早賣了還少賺好幾百我媽整天靠北此事,NOTABU
98876,大家用的到任天堂switch近距離連線功能嗎?幹你娘嗆我嗆夠了沒阿,ABU
52951,"去國外看演唱會是什麼感覺?小場去看人,大場去看三小",NOTABU
94275,"１打２也贏,４８４證明了理組＞文組?就說腦子不好使,高雄文組被洗腦選了92",NOTABU
17589,報告沒備份時電腦突然壞掉是什麼心情?現在都直接存雲端了好不好,NOTABU
51511,"有鄉民喝過馬賽魚湯嗎?要加豆腐,用味噌提味?",NOTABU
43338,1500能活一週嗎?南部可以活兩周了,NOTABU
97854,未來補習人數會減少嗎?台灣垃圾渣男一大堆,ABU
51223,沒女魚也瘦的八卦?美女與野獸,NOTABU
20183,"大螢幕輕薄筆電有gram以外的選擇嗎?估計是沒有,不過gram真的盤",NOTABU
88978,"可以給我一點祝福嗎?沒吃過從前一中學生餐廳的餿水,別說你知道啥叫難吃",NOTABU
60940,"有寶可夢大師今天要隨隊去太平島佔點嗎?就沒開放台灣,去了也沒辦法玩,",NOTABU
46793,歐文給我現形?歐文是誰?,NOTABU
92776,有台灣抖音都是8+9?網路越發達這些人都會越來越活躍洗腦你我成智障,ABU
70215,說婊子像補習班耳機插孔會被吉嗎?噁爛肥宅收,ABU
18049,"亞洲統神最近是不是怪怪的?他的台有去的不是他本身,是觀眾的歐付寶",NOTABU
94182,如何一句話說明朝史?中國史上第一個由南往被打上去的,NOTABU
30188,"晚餐可以吃什麼?都不會煮,那還是去吃屎吧",ABU
49717,為什麼賽車遊戲都沒有納智捷的車款?會一直去加油站,NOTABU
25430,"多數鄉民是不是大學都沒教法律常識?然後邊笑中國法治落後,實在是太神辣",NOTABU
89799,"兒子是甲甲還是肥宅哪個比較慘?某族群還有腦殘白癡在挺,肥宅根本沒人支持",ABU
93478,"問一下,沒受過棒球訓練,球速100到底?100很猛了一般人",NOTABU
42560,過年期間PS4要玩什麼遊戲?最後生還者,NOTABU
44230,"有認識的肥宅有在賣的嗎?肥宅是要賣甚麼,粗音周邊?",NOTABU
72774,你各位什麼時候放棄使用HTC的?坑台灣人的垃圾中國企業也挺,ABU
28506,"大家如果回到古代當王,還會推動女權嗎?王莽是被黑掉的好不好",NOTABU
80352,"朋友律師ㄧ試沒過該怎麼安慰他?念一年還過不了一試..轉行比較實在,沒救了",NOTABU
40864,"夜市撈的金魚,養得活嗎?印象中有大概從食指長度養到手掌長度",NOTABU
99962,"洗負評事件到底是什麼?用""某甲甲輸不起""搜尋標題,看第一篇就知道了",NOTABU
84955,"在內地上海工作是甚麼感J?就跟台北差不多,一堆人",NOTABU
41144,電影界的糞作分別有哪些?台片一堆連imdb都進不去,NOTABU
87588,"肥宅肛領完錢應該吃什麼?發錢啊,",NOTABU
80597,"吳珊儒是靠爸得金鐘的嗎?實力好的一堆啦,但是能跟吳一起搭檔你說,沒靠爸喔",NOTABU
98203,"大王沒什麼好酸的吧?誰啦,以為大家都那麼在意棒球喔",NOTABU
21738,哪裡有央視春晚?雖然是四天連假~但是遠不到春節的感覺吧,NOTABU
13477,蝴蝶效應?強調這種強調如果由兩組不同的人來描述,NOTABU
74214,"在台灣沒進一線ic廠484很丟臉?是的,自盡或領22K選一個",NOTABU
18723,紫爆沒人發廢文太扯了?幹垃圾球隊配垃圾裁判剛剛好,ABU
99877,"竹科宅寫個小秘密天眼通app有搞頭嗎?會被竹科人妻聯合抵制,再找人寫個反天眼通app",NOTABU
32456,484要工作過才懂得珍惜時間?當然是有工作又結婚又生小孩時你才會發,NOTABU
60678,"政黑9.2假正義,自助餐吃很飽?問題啊,現在是赤竹自己賣到中國去,不是中國跑過來",NOTABU
72579,"當公務人員怎麼增加收入的八卦?自願去做工程啊,然後跟廠商要回扣,爽賺",NOTABU
17238,"豬肉煮好,包一堆黑巧克力丟在路上?這是要引誘狗去吃的吧吃了狗狗就死掉",NOTABU
12096,"武藤敬司當年有多紅?我覺得光頭時期最強,因為閃耀魔術師這招太犯規了",NOTABU
53559,"弟弟不跟哥哥一起洗香香惹Q.Q?好久沒看你的文了,口味沒以前重了,難過",NOTABU
94846,金城武有整形過嗎?舉手投足之間讓你懷孕,NOTABU
25720,有帶烤雞當便當的八卦嗎?我都牽豬到辦公室烤,NOTABU
94573,能不能多一個分類叫做低卡?我愛你媽分類可以多加一個幹你媽嗎,ABU
84638,大家是不是對惡人作惡見怪不怪?台灣賤畜就是這樣,ABU
56467,"若瑟是不是史上最綠的啊宅?對約瑟還早死,根本超慘幫QQ",NOTABU
79226,有沒有玩家門的八卦?我都會偷按鄰居門鈴算玩家門嗎,NOTABU
94681,"朱木炎打得贏金卡法嗎?飛翔腳,下bbbbb然後一個半月斬",NOTABU
96267,"有沒有買零食短褲妹的卦?這樣好嗎?,分類是問卦耶",NOTABU
23771,"有人拉屎能憋住尿尿嗎?尿完,再拉不會?",NOTABU
23438,"子瑜年薪多少,?這規費每次繳是超過台灣平均月薪的",NOTABU
37620,有沒有台風的八卦?我還以為你在說賣烤雞的那個,NOTABU
54102,夜深了 來首天籟神曲吧?聽館長幹你娘也很有台灣味,ABU
82437,一句話證明自己是個廢物?八卦肥宅是也,ABU
99878,"女生說,喜歡暖男的八卦?女生不喜翻下面是冰棍,要暖暖的進去才酥福,嘻嘻",NOTABU
63051,國民法官是什麼智障制度啊?本來就低能制度,ABU
27154,姆咪上課睡覺?智障夠狗奶姆咪,ABU
37798,"有沒省錢從省小錢開始有多滷的卦?你說的並不是省錢的問題,而是投資本身的問題",NOTABU
76769,臺北最好吃的拉麵店是?在台灣還沒吃過好吃的日本拉麵,NOTABU
50996,"請問一下,這是什麼蔬果?為啥不當下問?",NOTABU
54016,"這2段今天初等考的英文翻譯有誤嗎?me,friend",NOTABU
49818,"台北淹水,那沒淹的地方算台北嗎?那是學弟啦",NOTABU
66304,"金雞獎中100的人在想什麼?我就沒中!,還好只買1張…",NOTABU
46842,多力多滋是垃圾食物嗎?我就是不知道才問的啊智障嗎,ABU
25836,是台灣人賤還是車商賤?加價購窮人去死的概念,ABU
95462,相聲瓦舍哪個梗最經典?現在真的是爛到一個極致不好笑在那裏耍白癡,ABU
20823,"處男給我按二喔?不行嗎,惹到你了嗎",NOTABU
62185,五毛會一起玩五樓梗嗎?肯定不會人家是網軍又不是像你們這群低能兒,ABU
69912,有沒有有家歸不得的八卦?有屌用不得,NOTABU
68248,"21歲如何存到存到30萬?如果你是女生的話,16歲之前很好賺",NOTABU
36519,"台鐵把自己弄臭還有人要考嗎?報到率60%,報到後離職率70%,你說咧",NOTABU
73845,"土豪哥,vs,Justin,Lee,誰吃的妹多?而且瑞哥除了禿頭至少人模人樣",NOTABU
22160,水管糞game廣告是不是不見了??開局抽五星 我幹你娘死胖子,ABU
60652,有自戀算是不是同性戀的卦?希臘神話真的可以學到很多男女關係,NOTABU
41966,"沒有邦交國的後果是陰帝無法過境美國嗎?只要美國同意,要個理由這麼簡單XD",NOTABU
12008,"機車待轉需要打方向燈嗎?不用打,之前不是有爭論過,有單位出來說明說不用打",NOTABU
80337,"有台灣早有送中協議的卦?台灣人就在台灣審判啊,中國畜牲就送中國啊",ABU
98161,"陽明交大合併改什麼名字好?驕陽大學,選我正解",NOTABU
67979,"惑,!,大便竟然比尻尻爽?說不爽的1個月不要大便",NOTABU
54777,"耳機專家請進,耳機罩停產怎麼辦?去訂耳罩套阿",NOTABU
14806,竹鼠484很可憐?這隻雞淋到雨了,NOTABU
95376,"有沒有升研究所補習的八卦?大學教超爛的,補習班學比較快",NOTABU
22282,"村子裡來了一個傷患說要打天下?先打蘇州再打南京,怎樣?",NOTABU
91532,請問什麼是姆咪?姆咪=智障的意思,ABU
94550,對人家客氣一點嘛?倒裝句XD,NOTABU
25484,"肥宅如果當中國古代妃嬪要取什麼稱號呢?你可以菇狗,古代后宮嬪妃是有列制的",NOTABU
42892,崩潰的人現實敢說嗎?我等跟我朋友說中國台北啊,NOTABU
78169,"牌形該做成「吃」還是「碰」?盡量做吃,要改牌型比較容易",NOTABU
24873,要開計程車需要具備什麼能力阿?夠卑賤最劣等的垃圾正當職業,ABU
43614,有沒有被自己選區立委封鎖的八卦?你現在知道你們那邊選區智力測驗的成績了吧,NOTABU
77107,"韓粉是不是心思細膩的一群人?84,韓流再下去,台灣必分裂",NOTABU
54719,"世界上最爽的工作是什麼?卸任總統,爽領禮遇",NOTABU
33944,"屁股跟大腿連接的線,該怎練?去玩芭比娃娃啦",NOTABU
76066,父系親戚貌似都有禿頭，該如何調適?幹妳娘禿頭真的超醜,ABU
57250,最有人氣動漫女角?找國民番:害賊王娜美,NOTABU
95759,"喜歡蘿莉又愛大奶是生病了嗎?250.41是哪一棟,我先報警了",NOTABU
26042,喝溫水或戒尻相信哪個比較智障?西醫都叫人喝38度的水你知道嗎,ABU
18555,"一提到毒瘤大家會想到什麼?Kobe毒瘤強暴犯終於滾了,排毒成功",NOTABU
43369,"為何有些人能接受在廁所?沒機會的人,有差嗎",NOTABU
96439,"黑熊是不是最垃圾的?我不是針對你,我說在座的各位都是垃圾",ABU
64880,禮拜五颱風假大家要去哪玩?所以台北市民不准放要放也得下周補班補課,NOTABU
34445,美麗的女孩都是加州女孩嗎?C皮只會c毒跟講話,NOTABU
83744,桌遊是不是摸女生最好的管道?遊戲主題就是把學妹放在桌上,NOTABU
43645,在一首青春的歌曲裡加一段法語對話?伊碟伊蝶碰,NOTABU
58992,"成龍演香水會怎樣?香水喝掉打醉拳,最後中毒變成智障",ABU
97467,"有沒有適合用來練英文的youtuber?希平方不錯,我是覺得,玩美服就好",NOTABU
54857,大家第一個認識年紀比自己小的公眾人物?當然是子瑜阿左左右右那什麼垃圾,ABU
65007,喜歡看獸X片是不是有病?狗最好是會想X女人,ABU
76321,有什麼覺得很讚的梗圖嗎?上班笑到崩潰,NOTABU
59996,蔡依林最高峰期是唱周杰倫寫的歌那時嗎?他現在在歐美也有一點知名度欸,NOTABU
51202,"有沒有最經典的續集電影的八卦?當然是,列火戰車2,至尊無上2",NOTABU
99364,"肉圓爸之後不繼續家暴的機率?聽過的是拳腳相向後再威脅要殺你,變本加厲的垃圾",ABU
32614,"麥可貝是不是拍出絕地任務後就江郎才盡?麥靠北拍絕地任務時只有30歲,少年得志",NOTABU
40118,卡提諾狂新聞的八卦?垃圾論壇加假新聞有什麼狂?,NOTABU
57190,有沒有沒人希望北韓打贏的八卦?目前挨美國揍的國家離並駕或超越還遠得很,NOTABU
52774,"母乳是什麼滋味?嘻三小,ㄤ三小",NOTABU
82651,有雙魚是垃圾的卦?星座就是沒用,ABU
54172,"有無婚姻板萬用推文,自己選的怪自己眼瞎?講幹話的垃圾一堆",ABU
83256,最近兇宅是不是變少了?你他媽才醜喇幹,ABU
53357,跟寵物講話很智障?有人說跟畜生講話超智障,ABU
67260,有沒有草包罷免草包的八卦?所以說解僱dismiss)他也沒錯啊,NOTABU
60136,"薪水、假V.S.同性結婚,都機?薪水才是重點,你不一定會結婚,但總要有錢吃飯",NOTABU
85009,交女友難還砲友難?肥宅去找初音啦,NOTABU
44825,城之內不直接主打電子機器人?因為不能搭時間魔術師啊只會靠賽垃圾,ABU
20690,涮涮鍋是不是窮人美食?肥宅最愛去了,NOTABU
73407,蘋果出的i-Tshirt賣多少錢比較合理?垃圾果粉才會買,ABU
19592,廢文發太多會變廢物嗎?我還沒發就已經是了,ABU
82084,城市與鄉村的思維484不同?鄉下選民好操弄美名純樸實際愚忠,NOTABU
62747,要怎麼找到勁敵?先走去大木博士家,NOTABU
26963,"有沒有ppt.cc的八卦?這有人問過,也有人解釋過你/一下很難嗎?",NOTABU
87627,"線上遊戲的寶物價隨便就千萬起跳?水藍魔力也是,水藍鼠幣好貴要1:2xxx",NOTABU
99022,如果病人麻醉不夠在手術中醒來怎麼辦?通常醫生都會帶鐵鎚進去預防這種情況,NOTABU
50842,"慣老闆是不是都腦殘啊?都不是天生腦殘,是自以為是後天變成腦殘",ABU
16889,"名字有,實,該怎麼取名?實尚時尚最時尚",NOTABU
85652,"有台灣的電影99%都是垃圾片的八卦?不是台灣電影垃圾,是台灣人垃圾",ABU
61779,大雄有看過靜香媽媽洗澡嗎?問大雄他爸,NOTABU
53190,"萬元牛肉麵為何沒人說盤?因為去吃的才不在乎那點錢,覺得說盤的都是",NOTABU
65719,"民主是個好東西?五百萬人的共同選擇,一千萬人的表態,很清楚了",NOTABU
73222,怎麼樣一副牌才會有五張K?輪到你打擊時站著不動就好了,NOTABU
85264,"花1.9億住77坪的房子,在想什麼?買豪宅其實也是在買鄰居,拓展人脈",NOTABU
99882,輸給中國還能高潮的八卦?腦殘覺青只會鍵盤裝B,ABU
47898,女人不應該讓男人太累?女生在上面就不會太累,NOTABU
68943,終於看開愛回不來?我們面前太多阻礙,NOTABU
83647,動物朋友跟畜生朋友差在哪?幹動物比幹畜生爽,ABU
16631,"沒有6/4的國家?6/3有48小時,你文組?",NOTABU
56787,把人的手綁起來是不是就不會rap了?克勞薩大人表示,NOTABU
17532,上海菜是世上最噁心的嗎?上海你要去吃龍鎮酒家的彈跳甲魚湯,NOTABU
72921,為什麼沒訂便當要幫有訂的人抬便當?不爽花錢選班代阿,NOTABU
66823,"airwxxk超大蠢背包?用它來裝筆電不錯用,但加電源.散熱板.滑鼠後其實",NOTABU
77688,台中74號快速道路是什麼智障設計?台中交流道設計比天龍國好太多,ABU
53651,"真的有人吃不完Costco烤雞?沒一個人吃過,不知道",NOTABU
74082,"用火車事故來發酵輿論還要多久?錄,檢調還有臉說「機械故障機率小」",NOTABU
18301,"愛因斯坦有多像一顆石頭?德語,一個石頭",NOTABU
39620,如何判斷對方真有錢假有錢?看他有沒有嗆換跑車然後上論壇問yaris,NOTABU
99695,什麼是龍筋保養?他媽的公三小,ABU
88294,"方儉拿到台電資料,準備開民間電力公司了?,是不是以後不能爽開冷氣一整天打電腦了",NOTABU
42518,有沒有高鐵南港站的八卦?學生買學生票R,NOTABU
35721,年資跟能力是正相關的嗎?這是廢物拿來唯一說嘴的東西,ABU
98677,手足球的八卦?怎麼不問腳棒球,NOTABU
39471,"為啥水煮餐都比較貴啊?因為不能用廉價的調味料,食材就要買很好",NOTABU
75318,肥宅組偶像團體SFJ48有搞頭嗎?幹你娘死肥宅給我滾啦,ABU
25288,有沒有釋昭慧之前是被黑的八卦?一個人先做壞事之後做了很多好事被讚揚=髮夾彎,NOTABU
39249,"很多人認為蠟筆小新本人已經死了?臼井義人都死了,你說呢?",NOTABU
68564,軍中伙房多可怕?想知道不會自己去?退伍出來才發這種廢物文?,ABU
80252,外面的食物怎一直在叫?犯罪嫌疑人+1,NOTABU
48920,"拉麵可以賣100-200元,那意麵呢?南部人吃的垃圾也拿來比",ABU
83707,沒吃到屋馬會死嗎?訂了男的不要去就好,NOTABU
14594,在監獄喝酒有多爽的八卦?可以偷偷和人家說我會避稅喔~~~嘿嘿,NOTABU
65651,"朋友生涯規劃被公司困住怎麼辦?你朋友是誰這麼垃圾,找新工作不會先辭職",ABU
49786,"把腿毛全部剃光摸起來跟女生腿有8成像?黃種人尤其華人,本來很多男人的毛就很少了",NOTABU
47582,"哪種刀厲害?七星刀,專做生魚片",NOTABU
25545,這是麥當勞的萬聖節活動嗎?拔掉就好阿,NOTABU
89527,暑假到處都是8+9?暑假真他媽機掰平日一堆智障屁孩8+9,ABU
72257,"為什麼我同事會這麼生氣?他媽的你們只是同事,別人講話你亂入個屁",ABU
87804,"有半夜想媽媽的八卦?一定是大一廢物菜B八,大二以後想阿母,直接翹課回家",ABU
36795,"同同會騎士蘿莉控嗎?蘿莉控最高,爺孫戀那個不算",NOTABU
37226,會便溺的人為什麽還要人家尊重牠?你是說甲甲嗎,NOTABU
81663,"有沒有囂張沒落魄的久的八卦?你誤會了,甲甲本來就沒穿褲子,只套襪子",NOTABU
14485,"台灣的本土文化到底是什麼?台語歌明明一堆經典歌曲,自己水準只聽911怪誰",NOTABU
32543,"胖丁之歌歌詞改成姆咪是不是更好聽?敢跟我大胖丁教爭鋒?,滾!",NOTABU
35410,最強歌姬的八卦?那英不是台灣的吧,NOTABU
76935,"miwa,和,大原櫻子,要怎麼分?miwa超可愛!大原櫻子就還好",NOTABU
24495,"可樂機/原料一台要多少錢?你要喝的夠快吧,不然那麼大台氣都消了",NOTABU
65121,"幹醫科裡面到底有幾成是重考生啊?台灣就一堆腦殘讀不了,用錢堆啊",ABU
55477,下雨天了怎麼辦?下雨的味道其實是水味請問水水知道嘛,NOTABU
46645,幹妳娘一直澇賽是三小?去看醫生吧,ABU
79679,"身上只剩下日幣萬円,嘟幾?哈,一堆買賣外幣的人才要擔心五萬日幣去一次就沒",NOTABU
31016,"早餐吃豬肺很怪嗎?豬肺口感很特別,個人也不愛",NOTABU
68363,"不覺得大喊""發大財""很丟臉嗎…?台灣發大財!",NOTABU
63456,有沒有陸客成長觀光外匯卻沒增加的掛?況且這些錢大部分是進少數人口袋,NOTABU
46093,為什麼現在手遊廣告滿滿的低能感?因為你看網路紅的東西多低能,ABU
95710,有沒有跑去大陸唸醫學系的八卦?北七喔去大陸念醫學系那邊醫師錢拿超少的,NOTABU
98344,軟校樣怎麼念?屏幕软打样,NOTABU
76380,請問自己到底是什麼?不管換什麼零件都是肥宅,NOTABU
63865,太陽神劍屌嗎?智障呀貝瑪昨天傍晚電影台才播過,ABU
73529,"有公務員薪水太低的卦?不會被裁員+裡面都廢物,強一點的升職很快",ABU
28501,"問兩個問題,幫忙解惑?菜逼八滾",ABU
34311,"有沒有空姐兼職的八卦?醒醒,你沒有朋友",NOTABU
87768,藝人相瑩雞排店在哪?竹圍啦以前吃過但不知道是她家開的,NOTABU
92332,夜店第一批開舞的人在想什麼?反正一定會有一團妹仔先當第一批,NOTABU
97930,怎會有人攻擊直昇機打輸坦克呢?我爸爸都用石頭打下美國衛星,NOTABU
96022,紙牌屋都是真的?戀童甲甲==,NOTABU
11399,"到底為什麼正妹都香香der?味道都一樣,只是龍妹你不想聞",NOTABU
70916,大家有口罩買嗎?可以預見一堆跟風腦殘平常都沒在關心的拼命搶購,ABU
87654,七年級50歲後該怎辦?等著被年輕人戰退休金啊,NOTABU
81698,"有沒有CG特效改變電影產業的八卦?實景還是實地拍比較便宜吧,要弄到很真,錢",NOTABU
90749,"昏迷5年是甚麼感覺?上述的事有上新聞,只能說辛苦了他母親",NOTABU
21418,我愛你中國的車子?中華民）國,NOTABU
31860,能夠把指考改成就業考嗎?後段大學理工去科技業也是有年薪百萬啊,NOTABU
26237,"勝敗乃兵家常事,大俠請重新來過?因為帳號再買就有了",NOTABU
98610,"niconico現在還好嗎?哇靠,龍華市場根本沒有小籠包店好嗎lol",NOTABU
62431,大家小時候有踢足球的經驗嗎?說真的還真只玩過足壘球,NOTABU
34719,"最喜歡吹電風扇的國家是哪個國家?為啥阿,是因為要把覽毛裡面的水吹乾嗎?",NOTABU
75999,有沒有走路絲襪妹的八卦?在座的各位都是垃圾,ABU
60987,"Wed,Feb1,13:05:08,2017?蛆蛆表示:還給軍人尊嚴",NOTABU
36601,"8/1以後不能在八卦板PO文的人想在這裡分享些什麼?傻傻的,看戲就好,懂",NOTABU
37616,哥哥跟弟弟住需要注意什麼?KY準備好,NOTABU
60646,身為員工的你怎麼看?我的話還是9點為主,NOTABU
76992,"達美樂有賣美樂蒂嗎?哈哈,你超幽默!",NOTABU
89617,"日本妹放棄原本讀的日本大學來台灣讀大學?日本的普妹到台灣就被大家捧著,當然好了",NOTABU
17593,"大家最想聽誰的演唱會?講錯智障是水團,肥皂團是過氣",ABU
63261,分類為什麼那麼重要?從你開始不要分,NOTABU
90141,有沒有駐版工讀生的八卦?那偶講最後一次三葉偶老婆好惹,NOTABU
70020,珍惜帳號的八掛?通常被水捅都是有人檢舉,NOTABU
94839,"外國有無相似YOUTUBER可對應台灣YOUTUBER?有一個華裔的之前到香港鬧事,比台灣還低能",NOTABU
35654,有沒有假問卦真業配的掛?遊戲也是啊都一樣,NOTABU
46329,現在記者的中文程度?尊重專業好嗎人家專業就是耍智障,ABU
57831,切洋蔥想哭怎麼辦?哭的時候快點去切,NOTABU
88401,有沒有污名化機車族的八卦?機車噴射空污標準已全球最嚴,NOTABU
45120,"弒父姦母會關多久啊?有教化可能,回家吃豬腳麵線啦,垃圾司法智障立法",ABU
67556,"sleepyuan,你又不看政見我嘛認真寫?誰說我不看?,錢!",NOTABU
50373,"瘟疫都被控制了,人類怎麼進化的八卦?這就是你們說的優勝劣敗,適者生存",NOTABU
94427,都市人等一下要拜拜嗎?古代23000100為子時為下一日,NOTABU
36415,仗義每多屠狗輩其實很有道理?事實就是先打廢物比台灣法律有用多,ABU
96185,年輕媽媽穿超短熱褲逛大賣場?他媽沒圖發三小文操你娘,ABU
40339,每天發黑飯新聞的都哪種人?就跟歐陽一家一樣啊,NOTABU
34656,當初國中班花都在嘛?台大醫學系…有些人就是命好,NOTABU
38803,書記書記初期設定的八卦?滾回森林喇,NOTABU
93765,為什麼小學生的順口溜好像不會因為時代而?今天大年初十啦,NOTABU
11510,魯蛇是一種蛇類嗎?跟死肥宅一樣都是一種不可燃的垃圾,ABU
28774,"為什麼Dcard不能有聯絡資訊?一堆廢物都留IG,瞎了嗎",ABU
18219,電子雞當年台灣爆紅的時候有跟上嗎?買正版的然後養死的人超蠢,NOTABU
81384,新北美食名產是什麼?哪個區啊~~新北這麼大,NOTABU
22779,酸酸的空氣?這篇就很濃,NOTABU
46576,"世界上存在過笑娼不笑貧的時代嗎?人站在妓院外面就會恥笑裡面的小姐,人",NOTABU
78492,天帝鋼彈打自由鋼彈怎麼會輸?你說這個誰懂啊,NOTABU
13133,"有沒有今年的代表字還沒出來的卦?其實有耶,好像是""苦""",NOTABU
58351,跟學妹一起烤肉是什麼感覺?結果是肥宅自己的ㄋㄋ被看,NOTABU
31914,一個人喝一箱啤酒是什麼概念?做在馬桶上喝嗎跑廁所會跑到煩吧,NOTABU
73523,長門怎麼從勝利組走向全盤皆輸的局面?過於天真被現實衝擊後矯往過正了,NOTABU
98112,"有沒有港警很忠心的八卦?你怎麼覺得會有良心,台灣都有人隨時在想",NOTABU
80079,台中購物節APP是不是垃圾阿?一個發包案3000萬寫這種糞東西,ABU
75711,"香港鼻哥之於成龍,美國鼻哥之於Who?台灣鼻哥,國動",NOTABU
11532,"南下?北上?拜神眾:神沒有是非,神是為解救台灣,",NOTABU
58828,有沒有櫃姐說話很甜的八卦>\\\<?可能她剛剛吃太多糖惹,NOTABU
93744,"夏季洪患、冬季空汙,高雄怎麼了?新北怎麼了?台灣怎麼了?地球怎麼了?",NOTABU
65827,我是腦殘果粉嗎?你全家都是腦殘果粉,ABU
62807,"碰到有人在招搖撞騙該揭穿嗎?其實不用鳥他們,若真的有傻子當真,",NOTABU
86198,欺負動物是不是很垃圾?哪部糞作喇蛤蛤,ABU
