id,word,label
97136,走私的東西可以充公拍賣繳國庫嗎?拍賣很多人搶阿,NOTABU
90736,"關鍵點在新竹市?新竹縣長是白癡沒跟新竹智堅講好被打臉,死好",ABU
81135,iphone的鍵盤是不是垃圾?我以為是我手殘的問題,ABU
27634,有沒有遊玩的最高境界的八卦?無聊阿不就跟孟子一樣愛靠北而已,NOTABU
91487,"霧霾能不能用風扇吹走的八卦?做一個超大風扇,吹去俄羅斯,中國或成最大贏家",NOTABU
28620,"附中在抗議什麼?求八卦,智障台媒只講拉白布條,學生訴求都沒提",ABU
80403,麥當勞昨天是不是薛翻了?有這麼賺那每天都買一送一就好,NOTABU
68007,小丑是不是不知道自己是小丑?台灣需要更多黑暗騎士宗瑞,NOTABU
96320,八卦版今天凌晨還會上演戒嚴嗎??終於啦，一堆智障在污染八卦版,ABU
12753,"哪個星座會常常叫人滾?滾,星座根本垃圾",ABU
45584,哪間大學是犯罪天堂?學生犯罪了也不會提他校名的學校,NOTABU
92347,"中國動不動就在送熊貓,是在搞什麼?你不知道淪陷區要跟正統中國納貢嗎",NOTABU
81350,我這裡風不大欸?啊是干我屁事,NOTABU
76925,"大家有做過什麼熱血的事嗎?寒假去歐洲晃一個月,冷死了一點都不熱血",NOTABU
13143,"棉花糖女孩,厚片女孩是?人家玻璃心不行逆?不像肥宅這麼耐酸",NOTABU
77354,換聖女貞德守得住滑鐵盧嗎?聖女貞德只會幫忙守住法國領土.不會去侵略,NOTABU
60606,做凱格爾運動屁股抽筋怎摸辦?學派大星跳屁股抽筋舞啊,NOTABU
59323,虱目魚皮湯是不是世上最偉大的發明?吃無刺虱目魚不就好了,NOTABU
12539,"泡過紅豆的水?富含營養,你要倒掉?,那你還煮什麼紅豆湯阿",NOTABU
97778,"為什麼女生在歐洲就願意吃路邊攤的八卦?跟台男吃路邊攤=寒酸,跟白屌吃路邊攤=浪漫",NOTABU
47529,"肥宅的屍體堆得像垃圾山會比垃圾山臭嗎?不,活著比死了更臭",ABU
38088,"某板主真的有在別板測試秒爆文後刪掉嗎?樣,一堆小圈圈自以為自己是個咖,選不上崩到",NOTABU
64749,麵屋虎匠?還有照相先對焦好嗎,NOTABU
53565,陳思宇白色力量國會發光?支持!!屌打藍綠垃圾,ABU
26360,有沒有大家都不給小玉一點愛的八卦?愛他就去把他睪丸割掉收藏,NOTABU
29331,"要從哪裡選片?選什麼選,最後還ㄅ肆右手幫泥發洩",NOTABU
36978,IG開始刪限時典藏了?不要嗆花花喔,NOTABU
67563,歐洲攻略到底在演山小?還沒看怎麼知道糞不糞,NOTABU
59503,"台北旅遊,(極樂陣線),(失敗陣線),最終章?看到第一篇還以為唬爛",NOTABU
10236,"五十幾歲的人生是怎麼樣的?蘇光頭50歲選台北縣長71再選市長,你說呢",NOTABU
54431,在交流道倒車的是智障嗎?台灣三寶正常釋放,ABU
30433,怎麼還沒有祭品文呢?這叫完全沒誠意,NOTABU
74617,"整天在便祕的女生心裡在想甚麼?馬的,喝大冰奶會烙賽,還便秘?",NOTABU
92145,"""肥宅""的手語要怎麼比呀?他看到你就知道了根本不用做任何動作",NOTABU
61290,"台灣為什麼都沒人在做3d單機遊戲?成本太高阿,一堆糞game一直出就知道多好賺",NOTABU
92094,"聽過路人最詭異的簡略用語是什麼?塑膠最怪吧,還是我真的老了…",NOTABU
19093,童貞男很丟臉嗎?幹你娘嗆夠沒,ABU
97259,"客家人會怎麼在美國商會演講?省得說了,心電感應",NOTABU
22769,"男生一定要會開車嗎?開車不難好嗎,開不好的原因通常是沒有車練習",NOTABU
92578,有勸世漫畫-變身的卦?幹你娘你他媽的智障嗎?這三小笑話不好笑,ABU
27102,"鹿鼎記2之神龍教,阿珂是烈女嗎?李嘉欣超正的,但阿珂真的是個賤人",ABU
71908,為何台北市民大道兩旁這麼多居酒屋?好貴同樣價錢在日本吃喝得滿足多了,NOTABU
59402,"醫師包養學生妹?好廢~,36歲主治醫生還比不過台灣理工科",NOTABU
17095,"為啥有宋七力前車之鑑台灣人還不醒?怎不說,那些人上輩子欠他的,這輩子來還",NOTABU
25203,一直在語尾講錢是邊緣人對吧?他媽的臭宅快睡覺好嗎,ABU
90089,有沒有貓貓很過份的八卦?幹你娘被圖嚇到,ABU
51550,有沒有早午餐店的八卦?給晚起的人方便的,NOTABU
86037,"有沒有airpods的八卦?我也是買airpods,啊爽就好",NOTABU
12575,台灣曾經在香港開過演唱會的藝人都在哪?事實就是這些垃圾藝人現在只想舔共,ABU
71675,"小智這麼卑鄙還能當主角的八卦?真的重看之後超想打他,垃圾又低能",ABU
56107,台灣是不是比日本有錢很多的卦?台灣都垃圾裝高級,ABU
10959,現在當攝影師是不是超爽?第一張好平,NOTABU
98637,"gungu哥是冤枉的八卦,已發完?古滾喇,賄選還寄騷擾信這種人確定要投?",NOTABU
92714,加油完為什麼要抄車牌號碼?做AB牌?,NOTABU
57909,家電廠掌握了什麼黑科技?我猜你想說的是SONY?,NOTABU
34129,撿到喇牙要怎麼辦?小強殺手耶~上網賣又要賺一筆囉!呵呵,NOTABU
94377,有沒有這是日本的八卦?講這祖國來的直接跪舔,NOTABU
59028,清晨一堆直昇機飛過的聲音?國民黨政變啦!,NOTABU
96613,有沒有十二萬分歉意的八卦?國賠至少幾億,NOTABU
91513,"物理系的固態力學怎麼都跳過群論?教授:這個是你的論文,寫好給我看",NOTABU
59812,"我沒有妹妹,被罵操你妹該怎麼辦?回嗆他空幹王啊",ABU
62879,南韓總統:因爲太寂莫?這件事真的超荒唐的~偉哉韓國政治,NOTABU
31810,"台灣為什麼不學國外的「兩輪選舉制」?但是政治容易動盪不安,在台灣被美中夾殺",NOTABU
24384,"某牌的漱口水為啥這麼辣?我是覺得還好喇,畢竟辣到真的很不舒服",NOTABU
42733,貨車耐操油耗少空間大價格卻比較低?貨車一堆垃圾在開你確定要買,ABU
14050,85年後公務員優存9~13%?小英總統在民意支持下會有明智的決定,NOTABU
65968,"學妹包包,有股淡淡果甜香味?剛去查了一下,糖尿病會有味道=v=",NOTABU
35756,有太子爺很可愛的八卦?很智障是真的,ABU
10239,中國對台機構是白癡嗎?就算是白痴台灣人也快擋不住了,ABU
39425,有沒有大四繳學生會費的八卦?垃圾學生會真他媽噁,ABU
19630,"有沒有傑昂的八卦?我記得主角群有幾個在人間被殺死,沒順利回到魔界",NOTABU
61446,一直被認為有女友怎麼辦?484很帥,NOTABU
33765,"正電拍拍,負電拍拍?我竟然讀完了",NOTABU
99977,"妹妹雞雞比我大怎摸辦QQ?叫他舔,舔一舔就大了",NOTABU
23997,幫我選QQ?貝爺吃什麼就跟著吃準沒錯!,NOTABU
52588,入境時豬肉用鋁箔紙包著驗得出嗎?有這麼好躲的話早就一堆東西走私進來了,NOTABU
61622,"老闆說代工廠都倒光看著辦?就沒人轉型,就產業變成血汗工廠..",NOTABU
66326,"Do,you,hear,the,people,sing?我猜過兩年台灣又要唱一次",NOTABU
71958,房市反轉的關鍵事件?台灣腦殘死光的時候,ABU
94148,要如何成為表特板神人的神人啊?長得像我一樣吧,NOTABU
51736,"天氣冷想穿羊毛衣怎辦?跟羊羊講啊,他會分一些毛給你,我就這樣",NOTABU
39484,有沒有晨翔好帥的八卦?小白比較帥,NOTABU
94640,"酸陳金鋒的人到底在想什麼?有人酸意外嗎,偷偷躲在電腦前酸最輕鬆了,真的上場",NOTABU
12608,有沒有今天台灣空氣綠爆的八卦?其實台灣夏天空氣都不差欸,NOTABU
31125,"寫出初音要用哪個程式語言?工殺小?,我老婆在我房間好好的",NOTABU
30971,"公民1495行動聯盟?一個是教育,一個是遊戲,真他媽智障",ABU
86475,"藝術歸藝術484連美術都沒念好?誰跟妳逃避現實,全扯到政治去",NOTABU
63872,"解放軍是有史以來軍紀最好的部隊嗎?我覺得以後碰到這人的文無視就好,越回他越High",NOTABU
44320,有沒有佔盡便宜必須低調的八卦?网邪雨鞋賺錢還要人家相忍為國,NOTABU
70259,瓜哥會如何主持成人展?耗子:我可以加入多人混戰嗎?,NOTABU
75619,為什麼不小心射個飛彈立委官員要孬成這樣?國際輿論不會在我們這邊的你知道嗎?,NOTABU
63093,"一般人過幾歲後就會開始對同輩親戚無感?社會化後,開始比較後",NOTABU
56609,有八卦板不談八卦的卦?廢物都不說自己是廢物,ABU
28460,"yeezy,350,V2,zebra的八卦?有看到8萬的",NOTABU
38540,"一支槍換五萬塊會不會很沒骨氣?不一定用的到,重點是你要夠有錢,子彈一顆不便宜",NOTABU
59543,有沒有招待所的八卦?有看過一棟外觀很普通~進去超級豪華~,NOTABU
14487,"老婆的閨蜜是不是「歸me」?不是,因為你會被說是刻意幫某直播平台業配",NOTABU
17788,人氣:11314八卦板要滅亡了嗎?受不鳥智障覺青跟噁爛肥宅,ABU
47351,他媽台中火車站根本沒火字啊?你他媽眼殘?那麼大一個火沒看到?,ABU
56946,台灣勞工意識甚麼時候才會抬頭?只會批評勞工的垃圾有心為勞工做事嗎?幹你娘垃圾,ABU
87538,"ね、明天指考,可以說聲加油嗎?明年加油喔!^_<",NOTABU
70345,"還有人在乎高房價問題嗎?你可以去買台東啊,為什麼只關心北部",NOTABU
48181,為什麼外勞男生都比台灣男生會打扮?台灣人是名的不會打扮吧,NOTABU
35657,在國道慢慢開的人在想?通常是不知道珍惜自己所剩無幾時間的廢物老頭,ABU
78450,急!快被當了怎麼辦?智障學店生還能被當,ABU
99998,"Wed,Jul6,02:02:32?花錢給人吸毒這個我不知道該說些什麼",NOTABU
73608,"有沒有便當店菜色的八卦?社會上有一群人不吃紅蘿蔔,可是也有加",NOTABU
22253,這幾句法文是要表達什麼?幹你娘死肥宅怎麼不去死,ABU
39089,"給你200萬願意被肛嗎?如果我是有錢人真想看大家表演,XD",NOTABU
80506,左撇子尻槍也是用左手嗎?就好像打網球一樣反手握拍,NOTABU
42394,有沒有小米進入全球企業500大的八卦?台灣人爆買啊,NOTABU
25555,在低能卡發露點照的女生在想什麼?那你要自己滾去問他們,ABU
29847,忘記怎麼發文了?啊你這不就發一篇了智障?,ABU
73065,有沒有總統的丈夫要叫什麼的八卦?去問小刀啊..,NOTABU
39129,"有沒有繞過唯讀發文被水桶的八卦?娘娘是我教先鋒,一出手便知笑點",NOTABU
18313,長榮工會郭芷嫣FB頭貼改國防部了?真的跟白癡一樣,ABU
75067,世界就是你最好的學校?世界高中喔?,NOTABU
56381,台灣年輕人比較弱嗎?你現在才知道台灣的年輕人嬌滴滴的不堪一擊嗎?,NOTABU
36639,鬼島的加班費為什麼比正常工時還少?台灣人只要餓不死就會逆來順受,NOTABU
33766,"25歲重考台太醬料還來得及嗎?考國考,別迷信醫科",NOTABU
78397,"7天假的遊行會有多少人?萬人響應,十人到場",NOTABU
87035,發明內衣的人是不是智障?都發明內衣了為什麼還要發明外衣,ABU
73660,豆皮4火鍋料的霸主嗎?辛西亞要噗要吃老先覺,NOTABU
29179,可以在家練跳水嗎?你這樣練只會變成一個穿連身帽裝的刺客,NOTABU
66660,理組中的垃圾是不是應該廢一廢?你這樣藥師護理師獸醫師會沒人作,ABU
64899,台灣汽車是不是要起飛了?小日本又要逼台灣人買爛貨,ABU
18990,有沒有很愛問垃圾話的八卦?會問這種問題的多半也是失敗組,ABU
77712,"很愛很愛你?駝獸,我也愛你,早上我騎你,晚上被人騎",NOTABU
57204,"公車上隔壁男生的酸味?醒醒,整部車除了司機跟你以外都沒人",NOTABU
19597,"鐵板燒師傅算是好職業嗎?不知道為啥常吃的店師傅,都跑路了(台南)",NOTABU
18413,"館長當過志願役班長為啥不撐到領終身俸?20年只當到班長,他是惹多少人?",NOTABU
83753,"""糖比毒品更可怕"",是不是太誇張了?台灣糖太便宜了還有飲料店的糖不是糖",NOTABU
77843,有沒有FB愛用#的八卦?完全無視hashtag的用意的一群智障,ABU
22535,養一頭母豬叫哈布斯堡是否貴氣?感覺這肉很貴氣,NOTABU
67016,"台灣版的景甜是誰?大S和景甜相比,大S已經算很有演技了好嗎",NOTABU
16279,"把自己的名字改成ふわふわ有什麼好處?呼哇呼哇哩,呼哇呼哇嚕",NOTABU
57941,咱們接下來要怎麼迎接內地的汕液比較妥當?你現在是想諷刺我們中國?,NOTABU
56917,"初音?你才過氣,",NOTABU
53325,"我放下槍回憶去年一起畢業的學校?來啊,你先攻,我後發制人",NOTABU
98555,便利商店不要24hr還不錯啊?7-11當年取名就是早上7點到晚上11點.,NOTABU
11375,當導演要拍什麼影片才會賺?要拍之前一定要有好劇本,NOTABU
35566,"台灣現在哪兩個科技產業比較能看?反正,台灣跟韓國搞的東西,都賺不瞭甚麼錢",NOTABU
43599,有聖墓騎士一直低調到現在的八卦?智障嗎?新聞都有播,ABU
51352,"台灣人怎麼看娶中國女生的人?不過中國女很多都交不到台灣朋友,思想差異很大,所",NOTABU
29458,"看正妹視力會變好嗎?視力不好女的都變正妹,過得更開心",NOTABU
61049,PTT是高齡化還是智障化?智障蟑螂化,ABU
71220,貼文沒人點讚有掛嗎?可悲的肥宅,NOTABU
24002,"C&C,lemon,與C.C,lemon?因為cc檸檬已經掛了阿,誰會去告",NOTABU
67204,"一支槍換五萬塊會不會很沒骨氣?不一定用的到,重點是你要夠有錢,子彈一顆不便宜",NOTABU
46227,"有沒有大東亞共榮圈套在中國也適用的八卦?自己制度爛還要強加別人入盟,一樣嗎",NOTABU
63919,"女生嫁給有錢人會開心嗎?每天被時超滿足,感覺被新台幣灌滿",NOTABU
57535,要怎麼證明自己有學士學位?在我的眼中你就算垃圾台灣人之一無誤,ABU
74103,婕兒送耐耐禮物><(小穹陣線)?好可愛(′・ω・‵),NOTABU
91736,人類最大的敵人就是自己嗎?是垃圾廢物長得醜還會霸凌人的同事,ABU
73176,反同團體沒申請路權為什麼不會被驅離?有抗議的立場先去申請路權啊,NOTABU
58326,有沒有日本伍佰-桑田佳祐的八卦?超好聽的!,NOTABU
86593,五十人民幣吃香腸?幹你娘垃圾中國人操機掰幹,ABU
74670,不禮貌鄉民團?DPP真的好棒棒呢喊聲愛台灣就沒事了,NOTABU
82404,Twitter 掛了??掛了 崩潰 幹你娘,ABU
18195,"神樣佛樣大王樣?又安打,超真貨",NOTABU
12230,"麥當勞ㄅ小心買太多了怎辦?台北除了蓋捷運,還有蓋什麼國際建設嗎?",NOTABU
96525,很多人不知道自己投什麼嗎?中國台北智障多,ABU
45084,女友是任容萱是什麼感覺?最愛的時候等於跟1/2任爸DNA趴趴趴,NOTABU
23055,"有沒有北部都吃什麼早餐的掛?又不是體力活,早餐像南部吃那麼油,對身體不好",NOTABU
29340,"學生會的學姐們一直開黃腔><""?當少女變成歐巴桑,節操值真的會直落谷底",NOTABU
76439,跟妹子去草山夜未眠要留意什麼?我覺得去那裡吃飯的都是智障,ABU
15385,"青年旅館好住嗎?多人合住的,你是要別人普鐳萬嗎",NOTABU
90858,"有沒有幹破你娘的八卦?低能台男8+9,被捅爆屁眼",ABU
44826,"有沒有超能奇兵的八掛?這部國中超愛看的,記得好像動畫有重製",NOTABU
10593,"桃園市雨下超扯了?重修國文啦,",NOTABU
41395,你知道為什麼你眼睛漂亮嗎;)?qqu.qqn==好蠢,NOTABU
71858,家後面傳來燒焦味要跟誰通報?先確定是不是有東西燒起來了,NOTABU
96870,有沒有直銷創業藍圖的八卦?我等等要灑兩億,NOTABU
62217,收入被抽25%是什麼感覺?做直銷的感覺吧,NOTABU
41665,"有沒有破壞死光的八卦?早就有人問過,我都快學會了",NOTABU
94094,"自備白飯吃一蘭可不可行?窮人吃三小一蘭,窮人去吃鬍鬚張",NOTABU
49851,五月天下一個該離開的是誰?其它四個人有沒有單飛都不重要,NOTABU
34570,空心菜怎吃才好吃?老菜不是給人吃的吧是給畜生吃的,ABU
67846,"每月賺不到3萬元484想著發大財比較實在?發大財是不可能的,想分餅的都要先翻桌",NOTABU
93468,"在麥當當和正妹撞到同樣的手機殼該衝嗎?衝,記得先叫律師準備好",NOTABU
52615,和姊姊洗澡起了生理反應?出門去走走好嗎,NOTABU
23471,女生被時就恍神是因為抽插很爽嗎?沒感覺很無聊所以發呆恍神在想等等要吃什麼,NOTABU
72937,戰女跟公主連結哪個臭??幹你娘都很臭,ABU
76416,"中國空拍機怎麼那麼強?我們都是無人戰機,請不要只看別人好嗎?",NOTABU
30176,"Twice的綜藝感要怎麼救?眼皮女矮爆,老實說小女友綜藝感也很不怎麼樣",NOTABU
80297,替代役5/1怎麼沒有放假?軍工教他媽的是勞工嗎白癡,ABU
49466,"酸不了的職業?一堆醫生從政,說不能酸肯定哪裡搞錯了",NOTABU
83184,有在夜店講英式英文會怎樣的卦?幹你妹我講的時候人家就說好拘謹的感覺,ABU
60983,"請問林奕含到底是想怎樣?人好好檢討活人的世界,假藉問問題公審死者是什麼",NOTABU
92993,有沒有噓文過敏症的八卦?可惡的手越種馬,NOTABU
61998,覺得老闆有病?幹你娘不會給他點錢買藥吃啊,ABU
47125,"有沒有烽火三國2的八卦?只玩過1超好玩的,聽說2很爛,不過還是會想玩玩看",NOTABU
92711,別在花錢罵傻屌胞弟了?真的很愚蠢啊,ABU
70105,教主需要釣嗎?馬雅人跟A圖王好釣嗎?,NOTABU
83848,有想過發明什麼東西讓生活更美好嗎?發明專殺垃圾酒駕的機器人,ABU
65578,開遊戲直播時只有一個人觀看是什麼感覺?那一個人是實況主,NOTABU
64782,噓為什麼是紅色的?乾這個表情符號真他媽肥宅,ABU
85480,"到底要遊行幾次?空氣不好然後得肺病,沒差,反正他們常得",NOTABU
26285,暗黑二最強符文組合是甚麼?哥都拿改小幅裸裝跑超慢屌打一堆人,NOTABU
54168,"吃美食衣服會炸開?我女跑友的爺爺,是那間學校的總帥也會這樣爆開",NOTABU
11429,"買到的筆電不可加RAM怎麽辦?換也行,除非你那台太奇耙,換不了",NOTABU
73118,炸蔬菜?把肉拿去油炸就比較營養?,NOTABU
39297,"暑假開始惹怎摸辦?不會跟著一起跑喔,超青春",NOTABU
36409,"為什麼中國音樂界沒辦法出現主流樂團?中國人唱高音都超級刺耳,雖然高但完全不好聽",NOTABU
10665,"聲優悠木,碧昨天穿歐式軍裝的八卦?帽子長的像日軍的..衣服倒是有一戰的感覺",NOTABU
47197,有沒有PTT忘記密碼很苛刻的八卦?兩年帳號早被砍了,NOTABU
92552,靠北三小和我操哪一句比較髒?靠北三小明明滿滿的台灣價值,ABU
47999,"我是低能兒?好,大家都知道了",NOTABU
18173,能忍受多久沒手機?有電視就沒差,NOTABU
64330,"night,of,fire?幾年後的台灣,無腦文青反核後的下場",NOTABU
64851,"醫護業罷工的話可以調什麼津貼?不要亂核刪比較重要,他媽的先改健保啊",ABU
18997,國立中興大學是學店嗎?中字輩算學店那就一堆學店都不如的廢物,ABU
31026,"其實死後根本沒有靈魂吧?與其說是靈魂,不如說人死後就會回到一個夢境當中",NOTABU
53593,大學體育選甚麼最屌?想到就!四年從沒搶到國標..,NOTABU
12355,中國軌道出軌已經是10年前的事?只能說中國在安全設備真的好台灣很多,NOTABU
61185,"Sat,Aug,27,21:14:25,2016?花格105去年千元有找屯了好幾支",NOTABU
40288,有沒有冬天呼麻的八卦?建議去荷蘭抽跟台灣的不一樣,NOTABU
72779,用額頭轉瓶蓋為什麼可以這麼好笑?幹你娘蓋那麼快是蓋三小!,ABU
59901,"八卦鄉民支持甲甲用專法還是民法的多?上次我說支持專法,被人罵的狗血淋頭",NOTABU
13726,有沒有田徑協會不相忍為國的八卦?體育界很看重血統跟人脈,NOTABU
68956,"到底是""做""還是""作""阿?國文老師:,",NOTABU
33680,"有沒有徐孝元的八卦?就棒球主播啊,說過我真的好想淫韓國",NOTABU
28353,"張無忌做錯的事是不是沒殺了周芷若?假問卦,洗版置入中國社史地經人事物又來",NOTABU
93772,"有沒有國軍很喜歡在牆壁上貼標語的八卦?以國家興亡為己任,置個人生死於度外",NOTABU
66087,花生跟芝麻湯圓是誰發明的?幹媽的減肥看到這篇怒吃20顆,ABU
94234,有沒有靠爸的八卦?廢物靠爸爸,ABU
78423,"這個天氣吃什麼最消暑?火鍋,流汗後就會涼了",NOTABU
75688,四X貓幾時開始玩RO的?真的超像的,NOTABU
45021,LeBron來台灣打系籃能保證一場不輸?台灣系籃水準打美國高中生都會輸慘慘,NOTABU
76375,就客觀來說族滅是促進階級流動嗎?貴族也是會有一堆白癡的,ABU
94215,到處動不動就說別人崩潰的是什麼人?智障9.2韓粉,ABU
97999,"男魔法師/女_____?黑魔導女孩,選我正解",NOTABU
56171,"會去玩跳舞機的都是什麼人?超級臭酸宅,宅到另外次元的那種,噁",NOTABU
56288,"高鐵的速度誰快?台灣高鐵設站太多,快變成台灣慢鐵了",NOTABU
48000,人工智慧對決人工智障會怎樣?人工智障會得到最多斗內,ABU
32139,"你要求加薪被人酸加薪不合理,該怎麼辦?只能說台灣社會自己不滿意的工作薪酬",NOTABU
97677,"國道遇到後面車輛逼車你會理嗎?真的,很多垃圾習慣逼車閃燈",ABU
73412,哪個版的使用者智商最低?你已經在這裡了,NOTABU
11010,"師生戀到底有什麼問題?然後由愛生恨,從此討厭那個女老師",NOTABU
58111,該怎麼買土耳其冰淇淋?用看著智障的眼神看著他就好了,ABU
21669,"3餐都吃超商食物會怎樣?比鈉的話,便當店的也不會比較好",NOTABU
13489,"台北哪裡可以踏青?肥宅要踏青,買VR就好",NOTABU
11475,在台灣什麼職位坐上去智商會暴跌啊?哈哈哈連長真的中肯被迫當智障,ABU
79170,人類使用私刑那跟牲畜有什麼區別?八卦就一堆智障中國台北人,ABU
40231,老夫子算抄襲嗎?說不是抄襲的快去領手冊,NOTABU
82561,有沒有國光客運改乘車站上車的八掛?國光太鳥拉,NOTABU
62092,"怎樣才算一個負責任的男人?就是你獲得或做了什麼,就要付出讓先前的相關人滿意",NOTABU
73074,"要花錢買馬力歐遊戲嗎?要,好遊戲本來就要使用者付費",NOTABU
67090,有沒有五層樓公寓的八卦?老公寓就長那樣吧,NOTABU
10420,現在地獄梗越來越弱智了嗎?是國民越來越弱智了,ABU
87574,"用什麼稀釋可爾必思最讚,?灌進後門裡再留出來",NOTABU
96347,黃金新聞時段只有一則新聞?你他媽看宗教台當然只有一則,ABU
56649,"甲甲捐血拿去入菜?大腦是一個很棒的東西,希望大家都有",NOTABU
15032,"有沒有老闆是災星的八卦?主角命格,然後你是等便當的龍套",NOTABU
49013,在醫院禁止吸煙區吸煙的是在想啥?吸菸的就是垃圾,ABU
80394,北部皇城內的可以帶肉去火鍋店煮嗎?會傷了皇………城內的和氣,NOTABU
81855,原住民信耶穌是不是比其它人瘋狂?平地還不是一堆整天去廟裡拜拜的…,NOTABU
24923,改管噪音車怎不罰車主聽自己管聲?那些人都聾子吧,NOTABU
92695,hebe跟田馥甄哪個比較自犬?真希望嘴臭的人能早點受到報應,NOTABU
39540,"肥宅忽然說出""其實我是個殺手""有加分嗎?用臭味殺人的腐臭殺手吧",NOTABU
10888,台南到底有沒有可能蓋捷運?捷運應該由台東市區貫通到台南市區才比較有效益,NOTABU
88485,這問題有那麼難嗎?這是傳說中的垃圾題目啊,ABU
45888,選舉後的星期一請特休有多爽?馬的月底又要去收租了,NOTABU
76810,鐵板麵好吃在哪?每次看到人點鐵板麵也會浮現這問題..,NOTABU
87954,劉以豪帥在哪?不只劉以豪李國毅也是大葉高材生,NOTABU
98493,"地方的媽媽都這麼辣嗎?沒圖沒真相,說故事也要看圖",NOTABU
26501,"請問有沒有蟲的八卦?很久沒洗澡了齁,長木耳了",NOTABU
55933,"欸!Duncan在紅什麼!到底?說個笑話,刺黑fangbr說刺迷崩潰",NOTABU
82302,有沒有在台灣的外國人youtuber的八卦?天天待在一個西門町就說懂台灣了,NOTABU
97192,"obov在美國會被種豬歧視嗎?你放心,鬼谷是東南亞,華人,越南人,印度人",NOTABU
14942,螞蟻是怎知道有食物的?發現的人有標燈,NOTABU
49048,"海苔加上去484顏值+50?好吧,記得來找我啊",NOTABU
60280,登入1000是不是很屌?哈哈垃圾菜逼巴我也沒有,ABU
73720,喜鵲怎麼克服黑洞引力的?繞過黑洞就好了啊,NOTABU
73212,D卡真的很低能嗎?Ptt這個樣子還有臉說別人低能喔,ABU
35486,"把角色畫的很正很可愛結果性別:男的八卦?有!至少我直樸的表達我喜歡冰雪的點,直接了當!",NOTABU
59702,"會在大學霸凌別人的都是什麼人?都成年了,智障才會霸凌",ABU
68521,有沒有香港人喜歡吃什麼的八卦?香港人好愛吃阿宗麵線喔@@,NOTABU
59864,"捷運上的肥宅?先拿手機出來蒐證,等等下車找捷運警察",NOTABU
38043,我不願讓你一個人?肥宅原來是人類啊!我一直以為是某種垃圾,ABU
58215,"台北工專?窮人唸台北工專,有錢人唸建國中學",NOTABU
36214,怎麼安慰失戀肥宅?死肥宅給我滾啦幹你娘,ABU
32487,gogoro是不是機車界的apple呢?但是台灣人愛垃圾,NOTABU
82529,"大薯份量有縮水嗎?盒子有加大啊,有問題嗎",NOTABU
71856,萬獸之王不是獅子?了獅子是三小?,NOTABU
38910,"到三重天台該注意什麼?不要按喇叭,不要盯著人看",NOTABU
33416,來台北一定要吃到餐廳?離開鄉下當然去吃麥噹噹啊,NOTABU
44024,戈登請的攝影師是不是有病?媽的智障攝影,ABU
17127,鄉民都讀什麼大學?他媽的我沒錢讀大學可以嗎,ABU
96575,"喜歡打手遊線遊的女生,頭腦裝啥?一天兩篇欸,被愛玩手遊的女生打槍喔,幫QQ",NOTABU
82955,在爭鮮點毛豆會很智障?想吃又有吃飽哪裡智障了簡直就是天才,ABU
79878,我484生病惹?去檢查身體吧,NOTABU
54208,"妹妹要被吃掉了該怎麼辦?先尻一槍,你就會看破這世間的虛無",NOTABU
17275,肥胖者是否根本不該住高樓層?那是肉體的撞擊聲撞給魯蛇們聽的QQ,NOTABU
