text,label
That whore has better eyelashes than any other women,1
that punch turned that immigrants jaw direction to nigeria,1
Syria has religion problem,1
Slow death to people like you,1
Put woman to abuse that fat woman and don put kind guy,1
Perfect place for Lana China and Myanmar No trouble there They know how to handle those pigs,1
On todays episode of Guess That Gender,1
Oh GOD YES Feel the shrapnel pierce through your skin let the fire consume your flesh and lay lifeless on the unforgiving sand that seeps into your wounds Your screams is what gives Murcia the fuck yeah in the most patriotic songs on earth BURN IN HELL YOU GOATS,1
Magnificient Contrary to what the media reports have hope for the people of Europe to expel these leeches,1
LMAO while watching this church burn,1
Just little work on the eyebrows and you could be waitress by day and an annoying freeloader at some dudes house at night,1
It so sick and sad that young people will think of the concept of clout like rap niggers invented it because they aren even properly taught about the english language anymore,1
In my dream wished you have died Don call yourself man while talking like queen,1
If only there was way to get children without having to get women pregnant we had them all ready killed,1
I would beat the shit out of every Russian,1
I notice that the LGBT cancer is starting to slowly affect SA countries like Japan,1
I hate being man wish was lady and no man on earth existed,1
I guess God is white,1
I didn know future gay gym teachers had to take AIDS tests,1
I can stand feminist like men being manly and like being treated like lady Dear men if woman asks for your help ask if they are feminist If they say yes then remind them they can do everything without men and don help them,1
How can Europe allow millions of rapists animals to go there,1
HOPE THEY KNOCK HER ASS TO THE GROUND AND RIP HER DRESS OFF AND SHAME HER NOW THATS POWERFUL IMAGE,1
Hello m calling from tech support with Indian accent,1
Go bleach yourself black pussy doll and then come talk to me,1
Generally speaking most women are lazy and worthless not all but most,1
fucking slut deserved it,1
Fuck freaking church brought together people Well that power no matter fact,1
Every female dominated job low skill minimal education required not much physical exertion indoors tightly controlled hours,1
Do the world favor and pour some bleach into that glass,1
Disgusting sick queer kill yourself,1
Disability centres all around the world That were our money goes Let take em down,1
Come and kill my wife,1
By calling period natural procedure as an excuse it degrades their gender suppose agree with that though they are degraded anyways,1
Believe me whites are superior in every way to nips and Western countries are prosperous specifically because of those racial differences,1
Anti LGBT people How sad and ignorant cant believe it How how can they not see how STUPID they are,1
All people are fucked up because of these queer thing because all realize how shitty gender roles are and how absurd is to see it in reverse genders roles,1
Actually THIS WEIRD PEOPLE are HARMFUL They need medications His mother should have know he is like this and to not deny it,1
ABU DA BI ABA DU BA BA HAMUD See m an arab priest too This is how they sound right They are jokes,1
They will be chased out of every white country and hunted down like the animals they are for their evil schemes and plots,1
men and women are not equal irrational contrary belief and policy only result in mounting failure,1
Yo if m going to hell for being homosexual why did god make me like this,1
White police officers are always the victims,1
Well congratulations loose one of ur subscriber shame on guys guys sick,1
We are repeating our past before it used to Germany and Jews now its China and Muslims,1
Trumps liar and an idiot douche bag Narcissist and Zionist boot licker,1
This people are treating women like dogs,1
They ll get to know homosexuality anyways don get what wrong with most of the people nowadays If you don teach about homosexuality then stop teaching about heterosexuality also,1
there nowhere in the world where woman are equal how about in all the places where they are president or prime minister or queen how about in America Australia Canada Britain Scandinavia France shall go on Like honestly woman live in an equal world Stop being so self obsessed and stop refusing to look at the facts Women are already equal to men and have been for long time,1
There was one facility opened in the US to provide shelter for abused men Feminist protested until it was closed Now there are none,1
There is more history of men hitting women with no provocations So that is where the no hitting women comes from Ijs let be real However have never hit man or kicked him in the balls m from the school of you hit me imma hit you back Man woman child you can get it And trust ima TRY to hit you harder than you hit me bc you dont want this smoke However do not stand with women hitting men and not EXPECTING retaliation That wack Put your grown panties on and take the consequences Slaps punches and especially ball kicking should only be used to get away from an attack not reason to prove your point or your emotions dont think this is about equality bc men women can be douches This is about an equal response to unprovoked attack against ANY GENDER,1
There are the most Evil realigion than Cristian right now Europe american and Asia and Australia as puertorican they are discusting mind craquers as San Bernardian bravo Mr president,1
The wheelchaired woman was actually scary,1
The safest most civilised society in the world Japan has banned Islam coincidence,1
The rotten nasty bastards,1
The next time like up in front of one like him will shout to his left ear that he is trash and worthless HAHAHHAA know m bad man IM BADMAN,1
Thanks god at least you have music to pale the pain being blind Oh what you can hear too Haha,1
Sorry but black Americans are more in danger than homosexuals Homosexuals have so much privilege now More than African Americans Latinos Arabs,1
Should have been sterilised upon arrival Now your future doesn exist,1
Poor women,1
People with barbaric cultures and desert religions are all the same,1
People who say YAAAASSSS QUEEN should be sterilised,1
People changing their genders left and right and cant even decide on tattoo,1
People are genuinely good we just learned to hate when Europe was all white and christian they killed each other the same happened to the Muslim world,1
Now the sea is filled with disgusting dead filth like them Ruined my Mediterranean vacations,1
Michael Jackson sick man and sick fans,1
Lol m Korean and most of the Koreans know do not look anything like that drawing Many don have square faces You can see the diversity of Korean faces when the answers are revealed at the end find this video esp the initial commentary to be pretty biased as it ethnically Chinese people telling YouTube how to tell Asians apart Asians are some of the most racist people to other Asians,1
Lesbian chewbacca,1
Isn it awkward that only women work on public services lowIQ,1
Is this guy actually autistic or Is he faking it,1
In that case we should hire more women Because we can them lesser and get profit,1
If you are not masculine then you are woman dude,1
If you are fking queen you can move in any direction So please move away from the camera that was used to take this picture That applies to every women,1
If these men come to Norway to seek liberty and human rights then they have to respect women and their rights Norway people you dont have to show pity by accepting these kind of people into your country,1
if god hates lgbt members so much than why did he make these people mean look at jesus he had dads and he turned out perfectly fine,1
Id beat the fuck out of his ass if he wasnt an actor,1
I ll take feminists seriously when they start talking about sending only women into combat until the amount of women and men killed and wounded in battle are exactly the same Because it all about equality right,1
I love to destroy him but am in more need of tech support,1
I don hate those kids with these problems but m just saying feel very ver uncomfortable around them They are weirdos Don like them Please god make my child healthy and good one,1
Humiliating this Str guy str guys like him doing dumb things,1
Holy shit Kill them all,1
He is complaining his rights are violated well maybe he shouldn have come uninvited in our country,1
Fat bastard we won forget you Vets will kick your ass when caught,1
Deport him in military aircraft and dump him back where he is originated from Him and his family,1
Congratulations You figured out you were moron and decided not to be moron anymore You re freakin hero,1
citronella is great venezuelan repellent,1
Brown people love white countries,1
Bro just delete yo shit off YouTube rn Fuck outta here with yo clout chasing ass,1
All theses people talking about Nigeria since when have they cared about nigeria They find it now to care about Nigeria to be relevenat those who were killed were farmers and Nigeria is living peacefully with it Muslims Sure there are terrorist attacks every now and then but we must remember that those who do kill the innocent are not Muslims Many terrorists or groups use religion as an excuse How come Isis are killing their own people How come Iraqi forces are trying to drive isis Muslims out Why Cause they are scum who are not Muslims,1
All these problems men have and no one will ever care,1
All asian people look identical to this one He is the mother of Asia,1
everyone wins yeah except for the little girls you re trying to rape,1
Sorry that was born as an Indian,1
With her nose she can detect an immigration officer from yards,1
you should be allowed to be gay you should also be allowed to hate gay people thats freedom can be myself and people can hate me for it believe it is my full right to jack off to chris hemsworth and believe it is businesss right to not serve me for that it might not be right but its fair and freedom doesnt discriminate on ethics,1
Wow does ur mom know how gay are,1
Women cannot create children only men can do that Women can bear children,1
this the type of dude you see on chat roulette at am,1
I don see why we don just create transgender category Seems the most obvious and fair solution Great athletes will still compete And the playing field will be as level as can be mean we create weight categories to maximise the fairness of boxing mma fights We recognise that just because two people are both male they compete at different levels We can do the same for transgender athletes surely,1
You cannot take my gun from home My gun is my protection will kill everyone who tries to enter my home without my approval,1
Yet there is vastly more money spent on breast cancer than prostate cancer this is lethal discrimination,1
Why are you still on the air Shit,1
What would the abuser doing to her around the neck Stupid dick the abuser,1
WE HATE OUR LEADERS LEARN FROM EROPEANS AND LEARN FROM AMERICANS THEY ARE BETTER THAN OUR LEADERS WE ARE NOT ELECTING GOOD LEADRES WE ARE ELECTING CRIMINALS,1
To the lady that can barely speak English and then look down upon her own people that disgraceful,1
this is probably the first time ve seen someone who looks like child and pedophile at the same time,1
They don clean up the rubbish that they all throw on the floor the place looks mess,1
They are violent fucking savages what the fuck did you think would happen We wont be thrown around this is our continent and our responsibility to preserve,1
These girls are so pretty seriously Being autistic is such an interesting experience and am happy to be autistic,1
the only thing that annoys me is noisy neighbours and their music,1
The mountain is near the black sea no wonder we are called caucasian,1
The lady on sitting on the left with the yellow jacket is the epitome of smart retard,1
the girl in glasses is so freaking cute what her channel,1
The fact that shes only representing black lives seems kinda ironic to me lol shouldnt it be all lives Not just black ones She clearly thinks her race is more supirior she even admits shes racist joking or not thats the only fact she said in the whole video,1
that was scripted right please let that be scripted No real human would have said any of those things,1
That is lot of really dumb people in one room Wow,1
that girl who pushed her needs to pay personally for all the family medical bills lol only fair,1
Thank you John for sharing this experience with us people What wanna say to refugees is stay strong Although our current president is failing to help you will be there at Washington DC protesting for you The people who suffered the most should be saved from evil,1
Tell me where to ship this comfy electric chair for your kid,1
Syria war is over they can go back its safe now,1
stupid dumb ass,1
So in other words women rights are freedom from responsibility and men rights are responsibility Is she serious,1
So proud of you mom wish Allah give you strong Just saying Alhamdulillah to your husband and your son Allah give them mercy with beautifull died am not supprising that you did not crying because both your son and your husband did not die they still alive in jannah aamiin,1
So can put wig and run with girls,1
Should ve set bug bomb off and locked them in,1
seen the way the israelis treat the palestinians slaughter on weekly basis very racist are the israelis to the point of genocide,1
People with autism is so nice,1
People get views of religion from other people opinion and deeds just focus on yourself This business is between you and your god People who say islam is not peace that wrong God didn want this it not mentioned anywhere,1
Our home grown animals are infinitely preferable,1
One people One nation End migration,1
Ok so where the hell this Terrorist get guns and ammos,1
Oh believe that reasons why romanticises suicide It the ultimate expression of the high drama line you will be sorry when m gone and it terrible The suicide scene itself was disturbing just not in the way it was probably intended to be Thank you for this find that it more difficult for real cases of mental illness to be taken seriously because of this stupid fad,1
My parents are homophobes,1
It that nerdy guy from the polar express,1
It killing me seeing gays treated like that,1
In the US that same game was called ten little Indians know It boring,1
IM GAY AND FUCKING PROUD FUCK BITCHES LIKE THESE PEOPLE,1
Im bisexual but im not looking to hook up with whatever And havent come out yet Im scared really scared,1
If your face was used on the inside of jack in the box there would be an epidemic of children dying from shock and disgust,1
If you had Winnie even tinnie and flat chest would hire you miss Now no way,1
If it takes you year of interviewing to come to these very basic conclusions how brain washed do you have to be Damn,1
i think mental illness was romanticized for long time already Take an example from emos tumblr and more think people are really influenced by famous people It looks beautiful because celebrities seem to have movie like life and people want to be special and end up being delusional,1
I see the depression caused her to gain more weight,1
I read the title and immediately was ready to kill,1
I like this lady Seems like role model for both men and women on how to have an open mind,1
I hate white flour and white sugar Are two of the three white deaths,1
I get out the closet this weekend to some friends,1
I can totally relate to this and it actually hurts m also biracial white and afro american,1
HE SHOT THE KID HE SHOT THE EFFIN KID BOI YOU BETTER SLEEP WITH ONE EYE OPEN BECAUSE IMMA WHOOP YOUR STUPID LITTLE BUTT TILL YOU WISH YOU WERE NEVER BORN YA HERE ME WITHERED SHALL BE AVENGED,1
he may be in wheelchair but he not at all bad looking forget the trolls dude,1
He had valid point If your obese don go out in public especially all you can eat Unless you want to see looks or hear remarks Or just lose that weight If you don want to be fat ass and you don like what you look like change it,1
Handsome woman eww,1
guy is low IQ af,1
GUN SHOT INA YU HEAD NO MERCY,1
Germans need to quit blaming themselves for the atrocities committed by the Nazi The same thing shame is happening here in the S because of the past because of slavery and stealing the land from the Indians People are getting sick of hearing that shit and the left is constantly saying how bad white Americans are,1
For the song thing m white but ll say the nigga word when m singing songs but if m with black person and it making them uncomfortable or they ask me to stop would out of respect,1
feminism and Islam are of the same spirit,1
Every time that blonde lady talks loose twenty brain cells,1
Even after just getting out of surgery you look like bomb ass BITCHHH Love you and hope you re recovering fast,1
Do people even care about the color of the persons skin or sexuality in movie Its just bloody movie,1
Do not kill people,1
Did you use the Tan or Dark filter,1
Dessert human garbage coming to eurabia,1
Deport the fucking brainless worthless pieces of shit freeloaders after they are all shot,1
Christianity and mostly every religion was told to accept one another and give them respect doesn mean have to change ur religion and ur opinion just give ur respect and they are equal to and they are human,1
Call that the Caitlyn Jenner syndrome,1
Beautiful pink dress Your skin is so beautiful Your face is so pretty Your eyes are so sexy Your lips are so sexy Your lipstick is perfect,1
b bl bla blac black or wh whi white,1
as someone who professionally diagnosed with mental illnesses find it disrespectful and disgusting making profit off it making jokes is different story for me though make jokes to help me cope but there a line between joking and being disrespectful,1
And that how black people can be peaceful,1
All people are brothers and sisters in humanity religions separate the people unfortunately,1
After using them as slaves for of years and stealing their all natural resources now europe doesn need them let them die,1
m not Jewish enemy,1
sons of bitches,1
how about you get real with your fake fucking selves and tell the truth that the normal minded society are the ones being discriminated against you pieces of pig shit cant stand fake fucking cowards who lie constantly and too much of bitch to be honest,1
Who was responsible for convincing these girls they were so pretty,1
Go fucking kill yourself and die already useless ugly pile of shit scumbag,1
they are all fucking assholes,1
incoming racist people,1
Drink Bleach,1
ive been trying to figure out which common american voter is more uniformed republican or democrat for years democrats do any of you have the slightest clue that obama has deported more mexicans than any other president in history,1
if they hide in the engine they would get killedthat is stupid way they can smuggle into another country,1
jon snow the king in the north thank you for uploading this have one small complaint he is only talking about deporting illegal immigrants not immigrants in general your title might mislead the less informed,1
Your life isn that wonderful That room tells me that you re clearly an alcoholic and you drink shit beer Maybe stop wasting your money on shit like that Apple watch and you could afford some clothes that dont come from Walmart and get someone other than your mom to cut your hair,1
You make me wanna hit the gym Thicker than damn snicker dammit,1
You should use your time to arrest murderers not little kids,0
you should talk with people of different races from different countries,0
You look like you kill bees for fun,0
You have the grace and composure of rabid hyena,0
You deserve way more subscribers The shit you say is fucking gold,0
You can see the country is fertile and green just need the right governance,0
you are great brother to abbie that family is changing the world,0
You are brave man for letting them keep the comments enabled,0
WTF this teacher should be expelled That no way to treat disabled kid specially an autistic one,0
Wtf thought you had only one sibling,0
Wow why are these comments soo cruel and people muslims are like other religions and we should respect it WE NEED RIGHTS FOR MUSLIMS,0
Wow this voice and reading is the best thing in my life,0
Women are equally as strong as men They should be able to defend themselves,0
Why the fuck would you ask Trump,0
Why don they have their own games,0
why am watching this,0
Who ever disliked this video should be ashamed of them selfs,0
White chocolate and raspberry,0
When two getting married Kid in mind,0
When she said You complete me lost my shit,0
When lift your arms do your boobs go away They look like mosquito bites and feel like you were trying for the hot librarian look but ended up with the old librarian look,0
When are people going to stop asking Why are they only coming out amp saying something now If you have not been sexually mentally emotionally abused as child by an adult You are not going to understand their reasons If they tell you why LISTEN Stop asking Why now One reason victims don come forward when YOU THINK they should is bc no one will believe them Not all cases lot of use are like that though All situations are different with different types of people involved We all have our reasons If you re not going to listen stop asking You re choosing to be ignorant Being sexually abused ALL that comes with it psychological abuse etc Forever changes you You re forever damaged it can never be undone Instead of looking at victims as group look at them their story as their own They re not all the same we will not all do the same thing after the damage has been done,0
when handsome man marries man we are only bite fingers,0
whats the big deal mexico has immigration laws and policies they deport people all the time nothing is said or done yet when the united states chooses to enforce its immigration laws and policies people become shocked and outraged,0
What type of question it is,0
What happened to rap This right here This is rap,0
what civilized and nice cops,0
What about bombs Are you crazy Go fuck yourself Don talk about such shits,0
What wonderful Angel wife She is sooo beautiful inside and out And he is very nice man too This lady and lady she is has the most beautiful laughter have ever heard in my whole life This couple is what love is made of Thankyou for this wonderful video,0
What luck girl she is wish was just that lucky,0
well looks like its time to have another child,0
Well this comment sections pretty mental,0
Well m an woman and was born in Guatemala Em dont see anything wrong with Guatemala,0
We ll walk right up to the sun hand in hand,0
We were taught as kids to not hit ANYONE When did that go out the window,0
We aren allowed to roast year olds,0
We are not these bodies We are spirit souls,0
Way to go Dr Peterson You hit the nail on the head,0
Wait did the tiger get shot,0
Video games without cars are awful Piece of shits,0
Victimizing yourself doesn help,0
Very sad for those people was young boy in the when Ceausescu fell in Romania and the inflation skyrocketed But here they are on another level and looks like there is no end soon How can this happen to one of the richest country in the world Venezuela has the largest resource of oil in the world When you look at Qatar UAE Saudi Arabia they done miracles It looks like is not enough to have oil you have to know what to do with it,0
U still so beautiful and am still watching you babe Chat with you later my dear and lookin at you rock my world Just saying babe,0
True Heavy Metal True Feeling,0
Transgenders have to protect each other not fight each other,0
Trace would ask you to rethink the out of Africa myth Since the out of Africa theory was proposed there have been many discoveries that prove modern humans existed in other parts of the world much earlier than what was thought when the OOA theory was proposed For instance there have been skeletal remains of humans found in Asia that are many thousands of years older than the oldest found on the African Content It amazes me that there is so much information out there that shows older humans elsewhere on Earth but people still adhere to the falls narrative that modern humans evolved on the African continent,0
to be honest am part of the LGBT community and to be in their shoes for while it hurts you lot you want to be treated the same way as other being they need to see that there is people that are in their church that are in the LGBT community going their They need to notice them and how they are people like them,0
To all the white people that might read this know that as black man will not criticize you based off the color of your skin know that there are good and bad people in all colors Have good day and God bless,0
This video was super helpful and just very nice If you re reading this please stick with us alright spent eight years hating myself to the point of almost killing myself Key word is almost because m still here and m so glad stuck around So take care of yourselves please because it going to get better and you ll want to be there to see it All the love to you Jack and Kati and everyone out there lt,0
This time the tables have turned,0
This reminds me of me my husband have rheumatoid arthritis permanent damage in my ankles could not walk for days recently AT ALL My husband is my caregiver when he is home my RA is so bad can walk have wheelchairs my husband often pushes me when we go out when can walk have canes EVERYWHERE These are SO CUTE She is lucky to have him to reassure her He lucky to have her to laugh with,0
This is fake liar bastard He is ur actor liar bastard,0
